XVIII Concurso de Fotografía Dones con motivo del ...,Concurso Fotografía Dones,,https://www.peniscola.org/ver/16834/Concurs-de-Fotograf%C3%ADa-Dones-2024.html,,"February 20, 2025",,No,Dones,,,https://www.peniscola.org/ver/16834/Concurso-de-Fotograf%C3%ADa-Dones-2025.html,Premios,
Home Based Program (Residencia en Barcelona),"Residencia ""Home Based Program"" en Barcelona",,https://app.datarte.art/convocatorias/home-based-program-2024,,"February 20, 2025",,No,Datarte,,,,Residencia,
"Residencia de creación en Saga, Japón","Residencia ""Residencia de creación Saga"" en Japón",,https://app.datarte.art/convocatorias/residencia-en-saga-japon-2025,Japón,"February 20, 2025",residencia de artistas,Yes,Datarte,,,https://app.datarte.art/convocatorias/residencia-en-saga-japon-2025,Residencia,"Pintura, Escultura"
Home Based Program,"Convocatoria ""Home Based Program"" en España",,https://app.datarte.art/convocatorias/home-based-program-2024,España,"February 20, 2025",Programa de Residencia en Casa,Yes,Datarte,,,"No better option is found. The original URL provided is:
'https://app.datarte.art/convocatorias/home-based-program-2024'",Convocatorias,"Visuales, música, teatro"
"Open Call: Residencia artística en ISCP (NY, EEUU)","Residencia ""ISCP"" en EEUU",Revisar,https://fundacionamaamoedo.org/index.php/es//programs/category/conecta,,"February 18, 2025",,No,Fundación Ama Amoedo,,,,Residencia,
"27th Annual ""The International"" A Competition for ...","Convocatoria ""The International Competition Portraiture"" en el mundo",Revisar,https://www.portraitsociety.org/the-international-portrait,,"February 18, 2025",,No,Sociedad de Retrato,,,https://www.portraitsociety.org/the-international-portrait,Convocatoria,
"A Smith Gallery Call for Entries: ""Botanical""","Convocatoria ""A Smith Gallery Botanical"" en Internacional",Revisar,https://asmithgallery.com/main-gallery-call-for-entry/,,"February 18, 2025",,No,A Smith Gallery,,,https://asmithgallery.com/main-gallery-call-for-entry/,Convocatoria,
The Artist and Leisure Painter Open Art Competitio...,"Convocatoria ""The Artist and Leisure Painter Open Art Competition"" en",,https://artopps.co.uk/opportunities/talp25,,"February 18, 2025","Concurso de Pintura, premio internacional, premios de arte",No,Artopps,,,https://www.artworkarchive.com/call-for-entry/the-artist-leisure-painter-open-art-competition-2025,Convocatoria,
Shapes Of Influence 2025,,Revisar,https://www.artconnect.com/opportunity/q4s-A5Zx_r7CFNv31gs9k,,"February 17, 2025",,No,Springfield Art,,,,Oportunidad,
Nipkow Film Development Fellowship | Berlin,"Beca ""Nipkow Film Development Fellowship"" en Alemania",Revisar,https://www.artconnect.com/opportunity/7e_xNu59303kk-fhcZ2b2,,"February 17, 2025",,No,Nipkow,,,,Beca,
Embracing The Ocean,,Revisar,https://www.artconnect.com/opportunity/J7ZnvGK-VEXgAEaf8uPi6,,"February 17, 2025",,No,Marine Board,,,,Convocatoria,
Draper Grand Prize,"Beca ""Draper Grand Prize"" en",Revisar,https://www.artconnect.com/opportunity/eKX0rQVY5HgzyaXdW1Fp4,,"February 17, 2025",,No,Sociedad Internacional del Retrato,,,,Premio,
The Alexia Grants 2025,,Revisar,https://www.artconnect.com/opportunity/iMY4pPN9m0NX2OjIV99ul,,"February 17, 2025",,No,Art Connect,,,,Beca,
"Open Call: Artist-in-Residence, Munich","Residencia ""Artist-in-Residence"" en Alemania",Revisar,:,,"February 17, 2025",,No,,,,,Residencia,
"Open Call: ""Edge of Now"" Juried Group Exhibition","Convocatoria ""Edge of Now"" en",Revisar,https://www.bandadas.com/convocation,,"February 17, 2025",,No,Bandadas,,,,Convocatoria,
"European Marine Board: Artist Residency Programme, ‘EMBracing the Ocean’ 2025–2026","Residencia ""EMBracing the Ocean"" en Europa",Revisar,https://on-the-move.org/news/european-marine-board-artist-residency-programme-embracing-ocean-2025-2026,,"February 17, 2025",,No,EMBracing the Ocean,,,,Residencia,
Convocatoria CEC Rosario: Emergentes 2025,"Convocatoria ""Emergentes 2025"" en Argentina",,https://www.cecrosario.gob.ar/index.php/events/convocatoria-emergentes-2025-abierta/,Argentina,"February 17, 2025",Convocatoria Emergentes 2025,Yes,CEC Rosario,,,https://www.cecrosario.gob.ar/index.php/events/convocatoria-emergentes-2025-abierta/,Convocatoria,"Instalación, Visuales"
11th Fine Art Photography Awards,"Convocatoria ""11th Fine Art Photography Awards"" en todo el mundo",,https://fineartphotoawards.com/terms/,,"February 17, 2025",,No,Fine Art Photography Awards,,,https://fineartphotoawards.com/,Premio,
McKinney International Art and Design Residency 20...,"Residencia ""McKinney International Art and Design"" en EEUU",Destacar,https://indiana.slideroom.com/#/login/program/78093,EEUU,"February 17, 2025","Residencias Artísticas, oportunidad para artistas, residencia para artistas",Yes,McKinney International Art and Design Residency,,,https://indiana.slideroom.com/#/login/program/78093,Residencia,"Diseño, Visuales, Arquitectura"
BGD Photo Month: New Talents 2025,"Convocatoria ""New Talents"" en el mundo",,https://www.belgradephotomonth.org/en/open-calls/new-talents-2025/,,"February 17, 2025",,No,Belgrade Photo Month,,,https://www.belgradephotomonth.org/en/open-calls/new-talents-2025/,Convocatoria,
Tartget Prize International Painting Contest,"Convocatoria ""Tartget Prize International Painting Contest"" en España",,https://tartgetpaintingprize.com/index.php/rules/,España,"February 17, 2025",,No,Tartget Prize,,,"The most relevant URL to verify the originality of the source for the ""Tartget Prize International Painting Contest"" is:

https://tartgetpaintingprize.com/index.php/rules/

However, this URL does not indicate authority (e.g., .edu, .gov, .org). To confirm originality, it is crucial to cross-reference this opportunity with other sources.

If no better option is found, the original URL remains the best reference.

Therefore, the response is:
- https://tartgetpaintingprize.com/index.php/rules/",Premio,
Deadline Extended! Bba Photography Prize 2025,"Convocatoria ""Bba Photography Prize"" en",Revisar,https://www.artconnect.com/opportunity/3m0apbJniPRjesWZig2KU,,"February 16, 2025",,No,BBA Photography Prize,,,,Premio,
Deadline Extended! Bba Artist Prize 2025,"Convocatoria ""Bba Artist Prize"" en",Revisar,https://www.artconnect.com/opportunity/dpOZ8981Ffu0tDQlXahH_,,"February 16, 2025",,No,BBA Artist Prize,,,,Premio,
Cachan Contemporary Art Biennial,,Revisar,https://www.artconnect.com/opportunity/lTpWX-8B8TV8_hILIjpKk,,"February 16, 2025",,No,Art Connect,,,,Convocatoria,
Apila’s First Printing Award 2025,"Premio ""Obtener Disciplina"" en España",Revisar,https://www.artconnect.com/opportunity/UcuAe6Va0hSigp5Vdd1P3,,"February 16, 2025",,No,Apila Ediciones,,,,Premio,
Circular Wool Lab,"Oportunidad ""Circular Wool Lab"" en",Revisar,https://www.artconnect.com/opportunity/xJ523m3arcpX3Knjf04Qa,,"February 16, 2025",,No,Art Connect,,,,Convocatoria,
"2025-2026 Residencies For Wood, Metal + Ceramics At Jester","Residencia ""Jester 2025-2026"" en",Revisar,https://www.artconnect.com/opportunity/ouYBm7e4OKQFQ8mwGOu0C,,"February 16, 2025",,No,Jester,,,,Residencia,
The Crystal Ship 2025 Festival: Change,"Convocatoria ""The Crystal Ship 2025"" en Bélgica",Revisar,https://www.artconnect.com/opportunity/BKHv6ROe-UpTokyfaT-94,,"February 16, 2025",,No,The Crystal Ship,,,,Convocatoria,
The World Heritage Residence/Scholarship,"Beca ""World Heritage Residence"" en Suecia",Revisar,https://www.artconnect.com/opportunity/XUfilKjRxOdp3xY2MBMfV,,"February 16, 2025",,No,Gävleborg,,,,Oportunidad,
Fukuoka Asian Art Museum (Faam) Air Program,"Residencia ""Fukuoka Asian Art Museum Air Program"" en Japón",Revisar,https://www.artconnect.com/opportunity/jMmH2f5A873rLmEE-gULA,,"February 16, 2025",,No,Art Connect,,,,Residencia,
Call To Exhibit At Belgrade Photo Month Photography Festival,"Convocatoria ""Belgrade Photo Month"" en Serbia",Revisar,https://www.artconnect.com/opportunity/44PnZRGgCKf6-OUXOu4Y6,,"February 16, 2025",,No,Belgrade Photo Month,,,,Convocatoria,
Mckinney International Art And Design Residency 2027,,Revisar,https://www.artconnect.com/opportunity/Bo7MC_t3evUEaBbjzHIwL,,"February 16, 2025",,No,Eskenazi,,,,Residencia,
The Art Of Street Photography,,Revisar,https://www.artconnect.com/opportunity/9U_3e5G5cU3FiVu5P098S,,"February 16, 2025",,No,Chateau Gallery,,,,Oportunidad,
Long Meadow Residency Open Call,"Residencia ""Long Meadow Open Call"" en",Revisar,https://www.artconnect.com/opportunity/_tccRMyvgKelK20VCmKk3,,"February 16, 2025",,No,Long Meadow Art Residency,,,,Residencia,
Home - Call For Art,,Revisar,https://www.artconnect.com/opportunity/8S5BIPw-JFJqAGEPsXd7W,,"February 16, 2025",,No,Azalea Arts Community,,,,Convocatoria,
Convocatoria Marcos Juárez de Artes Visuales: insc...,"Convocatoria ""Marcos Juárez Artes Visuales"" en Argentina",Revisar,https://acortar.link/2spfiC,,"February 16, 2025",,No,,,,,Convocatoria,
I Concurso de murales Node Carabanchel,,Revisar,https://node-living.com/es/1er-concurso-de-murales-node-carabanchel/,,"February 16, 2025",,No,Node,,,,Convocatoria,
"IBA x OPA Open Call: ""Creative Living""",,Revisar,https://acortar.link/hvFv9o,,"February 16, 2025",,No,Discipline,,,,Convocatoria,
"Call for Art: ""Home"" An Online Exhibition by Azele...","Convocatoria ""Obtener Disciplina"" en",Revisar,https://www.azaleaartscommunity.com/open-calls,,"February 16, 2025",,No,Azalea Arts Community,,,,Convocatoria,
Open Call for Artists: Submit Your Work by Visual ...,,Revisar,https://acortar.link/0lT0EP,,"February 16, 2025",,No,Visual,,,,Convocatoria,
"Transmediale: Festival Curation 2026 (Germany, Online) ","Convocatoria ""Transmediale Festival Curation"" en Alemania",Revisar,https://on-the-move.org/news/transmediale-festival-curation-2026-germany-online,,"February 16, 2025",,No,Transmediale,,,,Convocatoria,
Open Call: 2025 Textile Artist Residencies at Stud...,"Residencia ""Open Call: Textile Artist"" en Canadá",Revisar,https://studiohcanadaresidency.ca/2024/11/07/open-call-2025-textile-artist-residencies-at-studio-h-canada/,,"February 16, 2025",,No,Studio H Canada,,,https://studiohcanadaresidency.ca/2024/11/07/open-call-2025-textile-artist-residencies-at-studio-h-canada/,Convocatoria,
Open Call: 17° Edición de Residencia Epecuén,"Residencia ""Epecuén Artistas"" en el mundo",Revisar,https://residenciaepecuen.com.ar/residencia-epecuen/,,"February 16, 2025",,No,Residencia Epecuén,,,https://residenciaepecuen.com.ar/residencia-epecuen/,Convocatoria,
The Untitled Space Open Call for Solo Exhibitions ...,"Convocatoria ""Untitled Space Solo Exhibitions"" en Colonia",Revisar,https://untitled-space.com/artist-opportunities/,,"February 16, 2025",,No,Untitled Space,,,,Convocatorias,
Primera edición de la Residencia de Archivos en La...,"Residencia ""Residencia de Archivos"" en Estados Unidos",Revisar,https://archivalbootcamp.com/program,,"February 16, 2025",,No,Archival Bootcamp,,,https://archivalbootcamp.com/program,Residencia,
Fukuoka Asian Art Museum Residency Programme 2025 for Visual Artists (Japan),"Residencia ""Fukuoka Asian Art Museum 2025"" en Japón",Revisar,https://on-the-move.org/news/fukuoka-asian-art-museum-residency-programme-2025-visual-artists-japan,,"February 16, 2025",,No,On-the-Move,,,https://faam.city.fukuoka.lg.jp/en/residence/requirement/,Residencia,
CIFAS: Producers’ Academy 2025 (Belgium),"Convocatoria ""CIFAS: Producers’ Academy"" en Bélgica",Revisar,https://on-the-move.org/news/cifas-producers-academy-2025-belgium,,"February 16, 2025",,No,On The Move,,,https://cifas.be/en/event/2025/pa-2025/producers-academy-2025.html,Convocatoria,
Call For Entry: The Art of Street Photography,"Convocatoria ""The Art of Street Photography"" en el mundo",Revisar,https://chateaugallery.com/call-for-entries/the-art-of-street-photography-2025,,"February 16, 2025",,No,Chateau Gallery,,,https://chateaugallery.com/call-for-entries/the-art-of-street-photography-2025,Convocatoria,
"Open Call: ""Birds"" by Main Street Arts","Convocatoria ""Birds"" en el mundo",Revisar,https://mainstreetartscs.org/exhibitions/birds/,,"February 16, 2025",,No,Main Street Arts,,,https://mainstreetartscs.org/exhibitions/birds/,Convocatoria,
Convocatoria AURA: Presentación de Proyectos Expos...,"Convocatoria ""Proyectos Expositivos AURA"" en Argentina",Revisar,https://www.entrerios.gov.ar/cultura/presentacion-de-proyectos-expositivos-destinados-a-aura-centro-experimental-de-arte-contemporaneo-aura-aura-ceacer/,,"February 16, 2025",,No,Centro Experimental de Arte Contemporáneo AURA,,,https://www.entrerios.gov.ar/cultura/presentacion-de-proyectos-expositivos-destinados-a-aura-centro-experimental-de-arte-contemporaneo-aura-ceacer/,Convocatoria,
Region Gävleborg: World Heritage Residence Scholarship 2025 (Sweden),"Beca ""World Heritage Residence"" en Suecia",Revisar,https://on-the-move.org/news/region-gavleborg-world-heritage-residence-scholarship-2025-sweden,,"February 16, 2025",,No,World Heritage Residence,,,"https://www.regiongavleborg.se/en/scholarship

This URL is the official source for the Region Gävleborg: World Heritage Residence Scholarship 2025, as it is the direct announcement from the organization responsible for the scholarship[1][2][5].",Beca,
"Eskenazi School of Art, Architecture + Design: McKinney International Art and Design Residency 2027 (USA)","Residencia ""McKinney International Art and Design"" en USA",,https://on-the-move.org/news/eskenazi-school-art-architecture-design-mckinney-international-art-and-design-residency-2027,,"February 16, 2025",,No,On-the-Move,,,https://eskenazi.indiana.edu/news/2024/2027-11-04-mckinney-international-resident.html,Residencia,
Premio Apila Primera Impresión 2025,"Premio ""Apila Primera Impresión"" en España",,https://www.apilaediciones.com/premio-apila-primera-impresion/,España,"February 16, 2025","Premio Literario, convocatoria, premio internacional",Yes,Apila,,,https://www.apilaediciones.com/premio-apila-primera-impresion/,Premio,"Ilustración, Diseño, Literatura"
Portraits Hellerau Photography Award 2025,"Premio ""Portraits Hellerau Photography"" en Alemania",,https://www.portraits-hellerau.com/en/,Alemania,"February 16, 2025","Premio Internacional de Fotografía, fotografía, premio internacional",Yes,Portraits Hellerau,,,https://www.portraits-hellerau.com/en/,Premio,Fotografía
FotoComBA Programa Internacional de Fotografía Expandida 2025 (virtual con exposición en galería),"Convocatoria ""FotoComBA Programa Internacional Fotografía Expandida"" en Virtual",,https://app.datarte.art/convocatorias/fotocomba,Virtual,"February 16, 2025","Arte Digital, Convocatorias, Premio Internacional de Fotografía",No,Datarte,,,https://www.fotocreativaba.com/fotocomba,Convocatoria,
Artist In Residence: Aerial Photography And Videography,"Residencia ""Aerial Photography and Videography"" en",Revisar,https://www.artconnect.com/opportunity/RgM_vkxcSkYpUyHIWynT1,,"February 15, 2025",,No,SWWDMN,,,,Residencia,
2025-2026 Art Residency,,Revisar,https://www.artconnect.com/opportunity/9JjFp9wnX5oOm5Wv33tUi,,"February 15, 2025",,No,Art Connect,,,,Residencia,
Furious Flower Poetry Center,"Oportunidad ""Furious Flower Poetry Prize"" en Estados Unidos",Revisar,https://www.artconnect.com/opportunity/3mNe7OcRqpZo2TD2yQWGu,,"February 15, 2025",,No,Art Connect,,,,Premio,
Call For Projects: Franco-Comorian Incubation Program,,Revisar,https://www.artconnect.com/opportunity/NrIi-LtahrdN6ejKUuxth,,"February 15, 2025",,No,Lalanbik,,,,Convocatoria,
Cameramore Photo Contest,"Convocatoria ""Cameramore Photo Contest"" en",Revisar,https://www.artconnect.com/opportunity/ZIvCTkgyEwBoMTSBkPQ2W,,"February 15, 2025",,No,TIPA,,,,Premio,
2025 Art Residency On Air Pollution (Multiple Locations),"Residencia ""2025 Art Residency On Air Pollution"" en múltiples ubicaciones",Revisar,https://www.artconnect.com/opportunity/P1orR3Cj556nROZcWILK6,,"February 15, 2025",,No,Creative Europe,,,,Residencia,
Resonance Residency For Flinta Musicians,"Residencia ""Resonance para Músicos FLINTA"" en Europa",Revisar,https://www.artconnect.com/opportunity/ZGxYA2CB8AKPxsfnJymrW,,"February 15, 2025",,No,Karne Kunst,,,,Residencia,
Spots Op West 2025,"Convocatoria ""Spots Op West"" en Bélgica",Revisar,https://www.artconnect.com/opportunity/-LD5VS4HIhWb8KV91FTWH,,"February 15, 2025",,No,Open Call SOW,,,,Convocatoria,
Portraits – Hellerau Photography Award 2025,,Revisar,https://www.artconnect.com/opportunity/2sBJpsTY6Qjn8-zpR_dfx,,"February 15, 2025",,No,Picter,,,,Premio,
Try Try Zine Residency 2025,"Residencia ""Try Try Zine"" en",Revisar,https://www.artconnect.com/opportunity/4kX6CKn65v9V4yd5Gy-fo,,"February 15, 2025",,No,Art Connect,,,,Residencia,
"Call For Artworks, Performances And Installations",,Revisar,https://www.artconnect.com/opportunity/Rrik8m6TtZ3HiC96jgsN7,,"February 15, 2025",,No,Begehungen,,,,Convocatoria,
Forge Project Fellowship 2025,"Beca ""Forge Project Fellowship"" en",Revisar,https://www.artconnect.com/opportunity/zTXBOPPsKHlWdxTyWJ0oy,,"February 15, 2025",,No,Forge Project,,,,Beca,
Summer 2025 Artist In Residence,"Residencia ""Obtener Disciplina"" en",Revisar,https://www.artconnect.com/opportunity/JSt5QnoZTGFLwRwAc0ciR,,"February 15, 2025",,No,Art Connect,,,,Residencia,
Quick Grant 2025,"Beca ""Quick Grant"" en",Revisar,https://www.artconnect.com/opportunity/PS8Aylxu_gxzTB-zruq10,,"February 15, 2025",,No,Art Connect,,,,Oportunidad,
Philip C. Curtis Artist-In-Residence Program,,Revisar,https://www.artconnect.com/opportunity/DBN8cok3bJK4fMll5ut3x,,"February 15, 2025",,No,Art Connect,,,,Residencia,
Indigenous Writer In Residency,"Residencia ""Indigenous Writer In Residency"" en Estados Unidos",Revisar,https://www.artconnect.com/opportunity/jMtOpy9vQZ4cABcd57atg,,"February 15, 2025",,No,ESF,,,,Residencia,
The Keyholder Residency,"Residencia ""Keyholder"" en",Revisar,https://www.artconnect.com/opportunity/JmvPaVtFK-RPdVLwIRb5u,,"February 15, 2025",,No,Printshop,,,,Residencia,
Artist In Residence Program,"Residencia ""Obtener Disciplina"" en",Revisar,https://www.artconnect.com/opportunity/T0xQG9Q_L9LteLglPysHL,,"February 15, 2025",,No,Art Connect,,,,Residencia,
Artists Of Color Summer Residency,"Residencia ""Artists Of Color Summer"" en",Revisar,https://www.artconnect.com/opportunity/V1fWli9CmdDrTyZvTzpEp,,"February 15, 2025",,No,Mudflat,,,,Residencia,
Convocatoria Abierta: La Bolsa de Comercio busca t...,,Revisar,:,,"February 15, 2025",,No,La Bolsa de Comercio,,,,Convocatoria,
Open Call: Muestras Temporales 2025 en el Centro C...,,Revisar,https://acortar.link/CGZQNN,,"February 15, 2025",,No,Centro C...,,,,Convocatoria,
"Open Call: Híbrida Laboratorio ""Obsesiones y capri...","Convocatoria ""Obsesiones y Capri"" en",Revisar,https://www.instagram.com/p/DDM6dtxRDiX/?img_index=1,,"February 15, 2025",,No,Obsesiones,,,,Convocatoria,
"Transition To 8: 2025 Art Residency on Air Pollution for Europe-based Artists (Greece, France, Slovenia)","Residencia ""Transition 8: Art Air Pollution"" en Grecia",Revisar,https://on-the-move.org/news/transition-8-2025-art-residency-air-pollution-europe-based-artists-greece-france-slovenia,,"February 15, 2025",,No,On The Move,,,,Residencia,
International Sculpture Symposium 2025 (Germany),"Convocatoria ""International Sculpture Symposium"" en Alemania",Revisar,https://on-the-move.org/news/international-sculpture-symposium-2025-germany,,"February 15, 2025",,No,Simposio Internacional de Escultura,,,,Convocatoria,
"Begehungen Festival: 2025 Call for Artworks, Performances and Installations (Germany)","Convocatoria ""Begehungen Festival 2025"" en Alemania",Revisar,https://on-the-move.org/news/begehungen-festival-2025-call-artworks-performances-and-installations-germany,,"February 15, 2025",,No,Begehungen Festival,,,https://www.begehungen-festival.de/en/,Convocatoria,
Karne Kunst/Sorora: Resonance Residency for FLINTA Musicians with Migrant Background in Europe (Germany),"Residencia ""Resonance para músicas FLINTA"" en Alemania",Revisar,https://on-the-move.org/news/karne-kunstsorora-resonance-residency-flinta-musicians-migrant-background-europe-germany,,"February 15, 2025",,No,On The Move,,,https://karnekunst.com/introducing-resonance-residency-empowering-flinta-musicians-in-europe/,Residencia,
Hypertextile 2025,"Convocatoria ""Hypertextile 2025"" en Portugal",Revisar,https://www.arteinformado.com/agenda/f/hypertextile-2025-235171,Portugal,"February 15, 2025",,No,Arte Informado,,,,Convocatoria,
"SE Center for Photography: ""College Call""","Convocatoria ""College Call"" en EEUU",,https://www.sec4p.com/college-prospectus-25,EEUU,"February 15, 2025","Convocatoria Universitaria, Convocatoria de Arquitectura, Convocatoria de Fotografía",No,Center for Photography,,,https://www.sec4p.com/college-prospectus-25,Convocatoria,"Arquitectura, Fotografía"
"SE Center for Photography: ""Architecture""","Convocatoria ""Arquitectura"" en EEUU",,https://www.sec4p.com/architectural-prospectus-25,EEUU,"February 15, 2025","Arte, Convocatorias, premio internacional",No,Disciplina,,,https://www.sec4p.com,Convocatoria,
Residencia Networking,"Residencia ""Networking"" en México",,https://app.datarte.art/convocatorias/Estudio-Marte-475,México,"February 15, 2025",Residencia Networking,Yes,Estudio Marte,,,"The most relevant URL to verify the originality of the source is:

https://app.datarte.art/convocatorias/Estudio-Marte-475

However, since Datarte is an aggregator service, it is not an original source. To find the original announcement, you should cross-reference the opportunity name ""Residencia Networking"" with other sources.

If the opportunity is directly announced by Estudio Marte, you should look for the official website of Estudio Marte. If available, the original URL would be:

https://estudiomarte.com/residencia-networking

If no direct link is found, the original URL provided remains the best option for verification purposes.

Therefore, the most relevant URL to verify the originality of the source is:

https://estudiomarte.com/residencia-networking

If this URL is not found, the original URL provided remains:

https://app.datarte.art/convocatorias/Estudio-Marte-475",Residencia,
Tartget Prize. Concurso Internacional de Pintura,"Concurso ""TARTGET PRIZE Pintura"" en España",,https://www.arteinformado.com/agenda/f/tartget-prize-concurso-internacional-de-pintura-231649,España,"February 15, 2025","Concurso Internacional de Pintura, Premio Internacional de Fotografía, Tartget Prize",Yes,Tartget Prize,,,https://artdeadline.com/ops/target-prize/,Premios,Visuales
Le Printemps Des Artistes - Cairo,"Convocatoria ""Obtener Disciplina"" en Egipto",Revisar,https://www.artconnect.com/opportunity/TwDC_ZToign5pYcrNoa7I,,"February 14, 2025",,No,ArtConnect,,,,Oportunidad,
In Solitude,,Revisar,https://www.artconnect.com/opportunity/ezhM5orJu4YpqgYprbF5Q,,"February 14, 2025",,No,Metaspace Gallery,,,,Oportunidad,
European Design Awards,,Revisar,https://www.artconnect.com/opportunity/LCfbCAdFwyKtPDrPSe13P,,"February 14, 2025",,No,European Design Awards,,,,Oportunidad,
Call For German Speaking Curators!,"Convocatoria ""Obtener Disciplina"" en Alemania",Revisar,https://www.artconnect.com/opportunity/g1tVUFjUYQoY5LqKMKOQ_,,"February 14, 2025",,No,Akademie Schloss Solitude,,,,Convocatoria,
Hanna Nagel Prize 2025,,Revisar,https://www.artconnect.com/opportunity/NjmGzUaUPmBQg-nSMJT_j,,"February 14, 2025",,No,Kulturförderung,,,,Premio,
Artist Publishing Cohort,"Oportunidad ""Obtener Disciplina"" en",Revisar,https://www.artconnect.com/opportunity/exlF3kenXYnITsX7jy9mQ,,"February 14, 2025",,No,Art Connect,,,,Oportunidad,
Les Jardins d’Étretat: Residency for Site-specific Artwork in Gardens (France),"Residencia ""Les Jardins d’Étretat"" en Francia",Revisar,https://on-the-move.org/news/les-jardins-detretat-residency-site-specific-artwork-gardens-france,,"February 14, 2025",,No,On the Move,,,,Residencia,
Beca Clínica-MAPA 2025,"Beca ""MAPA 2025"" en",Revisar,https://app.datarte.art/convocatorias/beca-mapa2025,,"February 14, 2025",,No,Datarte,,,,Beca,
Artist In Residence 2025,"Residencia ""Obtener Disciplina"" en",Revisar,https://www.artconnect.com/opportunity/RgM_vkxcSkYpUyHIWynT1,,"February 14, 2025",,No,Art Connect,,,,Residencia,
De Reus Foundation Art Prize,"Oportunidad ""De Reus Art Prize"" en Colonia",,https://www.artconnect.com/opportunity/2ExHRdIcU9zVwzfEFrulP,,"February 14, 2025",,No,Colonia Express,,,,Premio,
Convocatoria RAW,"Convocatoria ""RAW Cine No Ficción"" en España",,https://www.arteinformado.com/agenda/f/convocatoria-raw-234508,España,"February 14, 2025",Convocatoria RAW,Yes,Arte Informado,,,https://www.arteinformado.com/agenda/f/convocatoria-raw-234508,Convocatorias,"Cine , crítica, creación"
Phmuseum Photography Grant,"Beca ""Phmuseum Photography Grant"" en",Revisar,https://www.artconnect.com/opportunity/lMJzUqewl5y_sMVDGOlRI,,"February 13, 2025",,No,Phmuseum,,,,Premio,
New Voices Filmmaker Grant,"Beca ""New Voices Filmmaker Grant"" en",Revisar,https://www.artconnect.com/opportunity/FTLJ7_eoP1nIRb7Js9x5L,,"February 13, 2025",,No,New Voices Filmmaker Grant,,,,Beca,
The World Of Wearableart (Wow) Competition,,Revisar,https://www.artconnect.com/opportunity/USSL6nD-hnp8TYIasJfx-,,"February 13, 2025",,No,World of Wearable Art,,,,Convocatoria,
"Open Call: 5th ""Scene & Places"" Juried Art Contest","Convocatoria ""Scene & Places Juried Art Contest"" en todo el mundo",Revisar,https://www.gallery4percent.com/scenes-and-places,,"February 13, 2025",,No,Gallery 4 Percent,,,https://artshow.com/juriedshows/na.html,Convocatoria,
Open Call: 2025 Bayside Painting Prize,"Convocatoria ""Bayside Painting Prize"" en Australia",,https://baysidepaintingprize.com.au/,,"February 13, 2025",,No,Bayside Painting Prize,,,https://baysidepaintingprize.com.au/,Premio,