Open Call: 3rd Koi Artist Award,"Convocatoria ""3rd Koi Artist Award"" en todo el mundo",Revisar,https://koisartistaward.com/koi-artist-award/,,"March 1, 2025",,No,Koi Artist Award,,,https://arts.ca.gov/collective/blue-koi-gallery-242-4-3rd-koi-artist-award-500/,Premio,
"International Open Call: ""Future Holds Somthing Fo...","Convocatoria ""Future Holds Something For..."" en todo el mundo",Revisar,https://latinismoartandeducation.us/open-calls/,,"March 1, 2025",,No,Latinismo Art and Education,,,https://latinismoartandeducation.us/open-calls/,Convocatoria,
12° edición. Programa Intensivo de Curaduría Proye...,"Convocatoria ""Programa Intensivo de Curaduría"" en todo el mundo",Revisar,https://www.proyectopac.com/programa-intensivo-de-curaduriacutea.html,,"March 1, 2025",,No,Proyecto PAC,,,https://www.proyectopac.com/programa-intensivo-de-curaduría.html,Convocatoria,
LABS 2025 - Utopía/Distopía III,"Convocatoria ""LABS Utopía/Distopía III"" en Chile",,https://app.datarte.art/convocatorias/labs-utopia-distopia-artistas-emergentes-2025,Chile,"March 1, 2025",convocatoria,Yes,Datarte,,,"No better option is found. The original URL provided is:
https://app.datarte.art/convocatorias/labs-utopia-distopia-artistas-emergentes-2025",Convocatoria,"Visuales, Escultura"
"SlowArt Productions presents ""Arte Natura"" at Limn...","Convocatoria ""Arte Natura"" en todo el mundo",,https://www.slowart.com/prospectus/natura.htm,,"March 1, 2025",,No,SlowArt Productions,,,https://www.slowart.com/prospectus/natura.htm,Convocatoria,
RIDCC: 2025 Choreographic Duet Competition (Netherlands),"Convocatoria ""RIDCC Choreographic Duet Competition"" en Países Bajos",,https://on-the-move.org/news/ridcc-2025-choreographic-duet-competition-netherlands,,"March 1, 2025","oportunidad para artistas, premio internacional, residencia para artistas",Yes,On-the-Move,,,https://www.ridcc.com/event/,Convocatoria,"Coreografía, Danza"
Never Such Innocence Competition 2024/25,"Convocatoria ""Never Such Innocence Competition"" en Reino Unido",,https://www.neversuchinnocence.com/2024-25-competition,Reino Unido,"March 1, 2025","Premio Literario, convocatoria, premio internacional",Yes,Never Such Innocence,,,https://www.neversuchinnocence.com/2024-25-competition,Premio,"Danza, Coreografá"
Convocatoria para participar en la 5ªedición de Wh...,"Convocatoria ""WHITE BALANCE"" en España",,https://estartspace.com/evento/convocatoria-para-participar-en-la-5aedicion-de-white-balance/,España,"March 1, 2025","convocatoria, evento, participación",No,White Balance,,,https://estartspace.com/evento/convocatoria-para-participar-en-la-5aedicion-de-white-balance/,Convocatoria,Fotografía
2025 MUSE Photography Awards,"Convocatoria ""MUSE Photography Awards"" en mundo",,https://musephotographyawards.com/,,"March 1, 2025","Concurso de Pintura, Premio Internacional de Fotografía, Premio de arte digital",No,MUSE Photography Awards,,,https://musephotographyawards.com/,Premio,
XI Concurso de Artes Plásticas Dcoop 2025,"Convocatoria ""XI Concurso Artes Plásticas Dcoop"" en España",,https://dcoop.es/actualidad/abierta-la-convocatoria-para-participar-en-el-xi-concurso-de-artes-plasticas-dcoop-2025,España,"March 1, 2025","Certamen Nacional, Concurso, Premio Internacional de Fotografía",Yes,Dcoop,,,https://www.dcoop.es/actualidad/abierta-la-convocatoria-para-participar-en-el-xi-concurso-de-artes-plasticas-dcoop-2025,Convocatoria,Visuales
Open Call 2025: ¿Te gustaría ser parte del Archivo...,"Convocatoria ""Archivo Activo 2025"" en Argentina",,https://www.argentinaperformanceart.com/opencall-archivoactivo-2025,Argentina,"March 1, 2025","Convocatorias, Investigación, Performance Art",Yes,Archivo Activo,,,"https://www.argentinaperformanceart.com/opencall-archivoactivo-2025

However, to verify the originality of the source, it is crucial to cross-reference this URL with other authoritative sources in the arts community. Unfortunately, the provided URL does not indicate a direct announcement from an official cultural organization or institution, which is typically a characteristic of an original source.

To further investigate, you might want to check if there are any official announcements from recognized cultural organizations or institutions related to performance art in Argentina. If such a source exists, it would be more authoritative and likely to be the original announcement.

For example, you could check the official websites of cultural organizations, galleries, foundations, universities, or museums in Argentina to see if they have announced the same opportunity. If no such source is found, the original URL provided might still be a valid source, but it would be less authoritative.

Here is the most relevant URL based on the information given:

https://www.argentinaperformanceart.com/opencall-archivoactivo-2025

However, it is recommended to cross-reference this with other authoritative sources to confirm its originality.",Convocatoria,"Investigación, Publicaciones, Performance"
VII edición del Certamen de Creación Artística par...,"Convocatoria ""Certamen Creación Artística"" en España",,https://www.uloyola.es/actividades/servicio-de-cultura-formacion-complementaria/crea-loyola/certamen-artistas-emergentes,España,"March 1, 2025","Certamen Nacional, convocatoria, premio internacional",Yes,Crea Loyola,,,https://www.uloyola.es/actividades/servicio-de-cultura-formacion-complementaria/crea-loyola/certamen-artistas-emergentes,Convocatoria,Pintura
SAC International Curatorial Residency Programme 2025 (Spain),"Residencia ""SAC International Curatorial"" en España",,https://on-the-move.org/news/sac-international-curatorial-residency-programme-2025-spain,,"March 1, 2025",,No,SAC,,,https://www.iktsite.org/news/sac2025,Residencia,
SAC Programa de Residencia Curatorial Internacional 2025,"Residencia ""SAC Programa de Residencia Curatorial Internacional"" en España",,https://www.arteinformado.com/agenda/f/sac-programa-de-residencia-curatorial-internacional-2025-234687,España,"March 1, 2025",Curaduría,Yes,SAC,,,https://www.iktsite.org/news/sac2025,Residencias,"Visuales, curaduría, exposiciones."
LOORE: Art Residencies for Ukrainian Artists and Cultural Workers (Estonia),"Residencia ""LOORE para Artistas Ucranianos"" en Estonia",Revisar,https://on-the-move.org/news/loore-art-residencies-ukrainian-artists-and-cultural-workers-estonia,,"February 28, 2025",,No,On The Move,,,,Residencia,
"Culture Action Europe: CultureAndHealth Platform Artistic Exploration Lab (Austria, Online)","Convocatoria ""CultureAndHealth Platform Artistic Exploration Lab"" en Austria",Revisar,https://on-the-move.org/news/culture-action-europe-cultureandhealth-platform-artistic-exploration-lab-austria-online,,"February 28, 2025",,No,Culture Action Europe,,,,Oportunidad,
Residencia LONG TERM – Producción,,Revisar,https://app.datarte.art/convocatorias/Uberbau_house-528,,"February 28, 2025",,No,Uberbau,,,,Residencia,
UNESCO: Technical Assistance to Implement the 2005 Convention in the Digital Environment,"Asistencia Técnica ""UNESCO 2005 Convención Digital"" en",Revisar,https://on-the-move.org/news/unesco-technical-assistance-implement-2005-convention-digital-environment,,"February 28, 2025",,No,On The Move,,,,Oportunidad,
Stiftung Niedersachsen Media Art Grants at the Edi...,"Beca ""Stiftung Niedersachsen Media Art"" en el mundo",Revisar,https://www.edith-russ-haus.de/en/about/grants,,"February 28, 2025",,No,Edi,,,https://www.edith-russ-haus.de/en/about/grants,Beca,
"""Artist of The Winter"" Juried Art Exhibition by UP...","Convocatoria ""Artist of The Winter"" en el mundo",Revisar,https://upwardgallery.com/ad/competitions/94/artist-winter,,"February 28, 2025",,No,UP,,,https://upwardgallery.com/ad/competitions/94/artist-winter,Convocatoria,
John Michael Kohler Arts Center: Arts/Industry Residency Programme 2025 (USA),"Residencia ""John Michael Kohler Arts Center Arts/Industry"" en USA",Revisar,https://on-the-move.org/news/john-michael-kohler-arts-center-artsindustry-residency-programme-2025-usa,,"February 28, 2025","oportunidad para artistas, programa de residencia, residencia para artistas",Yes,On The Move,,,https://www.jmkac.org/,Residencia,
Hokuriku Region Dance Festival: 2025 Artist-in-Residence (Japan),"Residencia ""Hokuriku Region Dance Festival"" en Japón",Revisar,https://on-the-move.org/news/hokuriku-region-dance-festival-2025-artist-residence-japan,Japón,"February 28, 2025","oportunidad para artistas, programa de residencia, residencia de artistas",Yes,On-the-Move,,,https://on-the-move.org/news/hokuriku-region-dance-festival-2025-artist-residence-japan,Residencia,
Ettijahat: Zad Programme for the Mobility of Artists from the Arab Region Residing in Europe 2025,"Convocatoria ""Ettijahat: Zad Programme Mobility Artists"" en Europa",Revisar,https://on-the-move.org/news/ettijahat-zad-programme-mobility-artists-arab-region-residing-europe-2025,,"February 28, 2025","oportunidad para artistas, programa de residencia, residencia para artistas",Yes,Ettijahat,,,https://on-the-move.org/news/ettijahat-zad-programme-mobility-artists-arab-region-residing-europe-2025,Convocatoria,
Beca Parcial: Incentivo Sur Global en PAR Residenc...,"Beca ""Incentivo Sur Global"" en Argentina",,https://www.instagram.com/par.residence/,Argentina,"February 28, 2025","Beca Parcial: Incentivo Sur Global, Incentivo Sur Global, Residencia",No,PAR Residence,,,"No relevant URL was found that indicates the original source of the ""Beca Parcial: Incentivo Sur Global en PAR Residenc..."" opportunity. The provided URL, 'https://www.instagram.com/accounts/login/?next=https%3A%2F%2Fwww.instagram.com%2Fpar.residence%2F&is_from_rle', does not appear to be an original source. It seems to be a login page for Instagram, which does not provide direct access to the opportunity announcement.

Therefore, the original URL provided is the best option available for further investigation.

- **Original URL:** https://www.instagram.com/accounts/login/?next=https%3A%2F%2Fwww.instagram.com%2Fpar.residence%2F&is_from_rle",Beca,Performance
La Maldita Estampa  Convocatoria de RESIDENCIAS ARTÍSTICAS 2025 / Barcelona -España,"Residencia ""La Maldita Estampa"" en España",,https://app.datarte.art/convocatorias/la-maldita-estampa-480,España,"February 28, 2025","Residencias Artísticas, programa de residencia, residencia de artistas",Yes,La Maldita Estampa,,,https://lamalditaestampa.eu/residencias-artisticas/,Convocatoria,"Grabado, Litografía, Serigrafía."
FotoCreativaBA Residencia Artística Buenos Aires 2025 [Res Artis member],"Residencia ""FotoCreativaBA 2025"" en Argentina",,https://app.datarte.art/convocatorias/fotocreativaba,Argentina,"February 28, 2025","Residencias, oportunidad para artistas, residencia artística",No,Datarte,,,https://resartis.org/listings/fotocreativaba/,Residencia,
Nature’s Wonder Online Art Exhibition,"Convocatoria ""Nature’s Wonder Art Exhibition"" en Virtual",,https://tenmoirgallery.com/natures-wonder-online-art-exhibition/,Virtual,"February 28, 2025","Exposición de Arte Online, Tenmoir Gallery",Yes,Ten Moir Gallery,,,https://tenmoirgallery.com/natures-wonder-online-art-exhibition/,Convocatoria,"Pintura, Fotografía, Escultura"
MUSE Design Awards abre convocatoria 2025,"Convocatoria ""MUSE Design Awards"" en Múltiples Países",,https://www.recursosculturales.com/muse-design-awards-2/,Múltiples Países,"February 28, 2025",Concurso de Diseño,Yes,MUSE Design Awards,,,https://competitions.archi/competition/2025-muse-design-awards/,Premios,"Arquitectura, Diseño"
Concurso Voces Nuevas de Poesía 2025,"Concurso ""Voces Nuevas Poesía"" en España",,https://www.recursosculturales.com/concurso-voces-nuevas-de-poesia/,España,"February 28, 2025","Concurso Voces Nuevas de Poesía, Premio Literario, convocatoria",Yes,Voces Nuevas,,,https://www.torremozas.com/premios/premio-voces-nuevas,Premios,"Poesía, Literatura"
Textografia 2025,"Oportunidad ""Textografia 2025"" en España",,https://www.arteinformado.com/agenda/f/textografia-2025-234510,España,"February 28, 2025","Arte contemporáneo, Evento artístico",Yes,Arte Informado,,,https://www.arteinformado.com/agenda/f/textografia-2025-234510,Convocatorias,"Poesía, Tipografía, Gráfico"
VII Certamen de Creación Joven Artistas Emergentes,"Convocatoria ""VII Certamen Creación Joven"" en España",,https://www.arteinformado.com/agenda/f/vii-certamen-de-creacion-joven-artistas-emergentes-234396,España,"February 28, 2025","Certamen Nacional, oportunidad para artistas, residencia para artistas",Yes,Crea Loyola,,,https://www.uloyola.es/actividades/servicio-de-cultura-formacion-complementaria/crea-loyola/certamen-artistas-emergentes,Convocatorias,"Fotografía, pintura, escultura"
Participación exposición White Balance,"Convocatoria ""White Balance"" en España",,https://www.arteinformado.com/agenda/f/participacion-exposicion-white-balance-233817,España,"February 28, 2025","Arte contemporáneo, exposición, participación artística",Yes,White Balance,,,https://www.arteinformado.com/agenda/f/participacion-exposicion-white-balance-233817,Convocatorias,"Fotografía, instalación, artes"
Edith-Russ-Haus for Media Art: Media Art Grants 2025 (Germany),"Beca ""Edith-Russ-Haus Media Art Grants"" en Alemania",Revisar,https://on-the-move.org/news/edith-russ-haus-media-art-media-art-grants-2025-germany,,"February 27, 2025",,No,On The Move,,,,Beca,
"""Galaxy"" Online Exhibition by Part Crowd Art Galle...","Convocatoria ""Galaxy Online Exhibition"" en todo el mundo",Revisar,https://www.partcrowd.com/opencalls,,"February 27, 2025",,No,Part Crowd Art Gallery,,,https://www.partcrowd.com/opencalls,Convocatoria,
Goethe-Institut Fellowship at the documenta archiv (Germany),"Beca ""Goethe-Institut Fellowship documenta archiv"" en Alemania",Revisar,https://on-the-move.org/news/goethe-institut-fellowship-documenta-archiv-germany,,"February 27, 2025",,No,Goethe-Institut,,,https://www.goethe.de/en/kul/bku/ser/fel.html,Beca,
"""Art Seen"" The Curator’s Salon Magazine Internatio...","Convocatoria ""Art Seen Magazine"" en el mundo",,https://www.thecuratorssalon.com/submissions,,"February 27, 2025",,No,The Curator’s Salon,,,https://www.thecuratorssalon.com/artseenmagazine,Convocatoria,
Open Call: Jackson’s Art Prize 2025,"Convocatoria ""Jackson’s Art Prize"" en el mundo",Revisar,https://www.jacksonsart.com/artprize/,,"February 26, 2025",,No,Jackson's Art Prize,,,https://www.jacksonsart.com/artprize/,Premio,
Open Call: Grand Prix Images Vevey & Book Award 20...,"Convocatoria ""Grand Prix Images Vevey & Book Award"" en todo el mundo",Revisar,https://www.images.ch/grand-prix/,,"February 26, 2025",,No,Grand Prix Images Vevey,,,https://www.images.ch/grand-prix/,Convocatoria,
Open Call 2025: Sea & Urbanism in Kavala,"Convocatoria ""Open Call 2025: Sea & Urbanism"" en Kavala",Revisar,https://eutopiaart.com/open-calls-2025/urbanism-and-sea-kavala-2025,,"February 26, 2025",,No,Eutopía Art,,,https://eutopiaart.com/open-calls-2025/urbanism-and-sea-kavala-2025,Convocatoria,
"""Landscape"" Juried Art Exhibition by UPWARD Galler...","Convocatoria ""Landscape Juried Art Exhibition"" en el mundo",Revisar,https://upwardgallery.com/ad/competitions/99/landscape,,"February 26, 2025",,No,UPWARD Gallery,,,https://upwardgallery.com/ad/competitions/55/landscape,Convocatoria,
Open Call: Artists of The Season by ART from HEART,"Convocatoria ""Artists of The Season"" en todo el mundo",Revisar,https://www.artfromheart.co.uk/artist-of-the-season-submit,,"February 26, 2025",,No,ART from HEART,,,https://www.artfromheart.co.uk/artist-of-the-season-submit,Convocatoria,
15th Annual “Figurative” Online Art Competition,"Convocatoria ""15th Annual Figurative Art Competition"" en todo el mundo",,https://lightspacetime.art/15th-figurative-art-competition-2025/,,"February 26, 2025",,No,Light Space & Time,,,https://lightspacetime.art/15th-figurative-art-competition-2025/,Convocatoria,
KRILA: 6th TranziT European Festival of Contemporary Theatre Practices (Croatia),"Festival ""KRILA TranziT"" en Croacia",Revisar,https://on-the-move.org/news/krila-6th-tranzit-european-festival-contemporary-theatre-practices-croatia,,"February 25, 2025",,No,TranziT,,,,Convocatoria,
"38th Annual InFocus Photography Competition, Exhib...","Convocatoria ""InFocus Photography Competition"" en el mundo",,https://www.infocus-tcaa.org/call-for-entries-2025.html,,"February 25, 2025",,No,InFocus,,,https://www.infocus-tcaa.org/call-for-entries-2025.html,Convocatoria,
FICIC Festival Internacional de Cine Independiente de Cosquín 2025,"Festival ""FICIC Cine Independiente"" en Argentina",,https://www.recursosculturales.com/ficic-festival-internacional-de-cine-independiente-de-cosquin/,Argentina,"February 25, 2025","Arte contemporáneo, Festival de Cine",Yes,Festival Internacional de Cine Independiente de Cosquín,,,https://cosquinfilmfest.com/bienvenidos/,Convocatorias,"Cine, audiovisual, televisión"
Open Call: Scenes From Real Life,"Convocatoria ""Resonancia del Yo"" en Italia",,https://www.loosenart.com/pages/calls,Italia,"February 25, 2025",convocatoria,Yes,LoosenArt,,,https://www.loosenart.com/pages/calls,Convocatoria,"Pintura, escultura, arquitectura"
A Studio in the Woods: Self as Universe Artist Residencies 2025–2026 (USA),"Residencia ""Self as Universe"" en USA",Revisar,https://on-the-move.org/news/studio-woods-self-universe-artist-residencies-2025-2026-usa,,"February 24, 2025",,No,On the Move,,,,Residencia,
Vapores Artistic and Research Production Residency on the Monnegre River 2025 (Spain),"Residencia ""Vapores Artistic Research Monnegre River"" en España",Revisar,https://on-the-move.org/news/vapores-artistic-and-research-production-residency-monnegre-river-2025-spain,,"February 24, 2025",,No,On The Move,,,,Residencia,
"Festival Pangue Videoarte 2025  ","Festival ""Pangue Videoarte"" en",Revisar,https://app.datarte.art/convocatorias/festival-pangue-videoarte-2025,,"February 24, 2025",,No,Datarte,,,,Convocatoria,
"Alliance for Socially Engaged Arts Fellowship 2025 for Arts Leaders in Europe (Italy, Online)","Beca ""Alliance for Socially Engaged Arts Fellowship"" en Italia",Revisar,https://on-the-move.org/news/alliance-socially-engaged-arts-fellowship-2025-arts-leaders-europe-italy-online,,"February 24, 2025",,No,On the Move,,,,Oportunidad,
CreArt: Kaunas Land Residency and Art Installation in Public Spaces 2025 (Lithuania),"Residencia ""CreArt Kaunas Land"" en Lituania",Revisar,https://on-the-move.org/news/creart-kaunas-land-residency-and-art-installation-public-spaces-2025-lithuania,,"February 24, 2025",,No,On The Move,,,,Residencia,
"Architectural League of New York: 2025 Deborah J. Norden Travel Fund for Architects in the United States of America, Canada, and Mexico","Beca ""Deborah J. Norden Travel Fund"" en Estados Unidos, Canadá y México",Revisar,https://on-the-move.org/news/architectural-league-new-york-2025-deborah-j-norden-travel-fund-architects-united-states,,"February 24, 2025",,No,Architectural League,,,https://archleague.org/competition/2025-deborah-norden-fund-call-for-proposals/,Fondos,
Open Call: Contexture feat. I Am Woman Project,"Convocatoria ""Contexture feat. I Am Woman Project"" en todo el mundo",Revisar,https://www.thehouseofsmalls.com/opencalls,,"February 24, 2025",,No,The House of Smalls,,,https://www.curatorspace.com/opportunities/detail/contexture-feat-i-am-woman-project/8898,Convocatoria,
"MostraFemArt 2024-2025: ""No me cuida la historia, ...","Convocatoria ""MostraFemArt 2024-2025"" en España",,https://femartmostra.org/convocatoria-oberta-mostra-femart-2025/,España,"February 24, 2025","Convocatorias, Residencias Artísticas, premio internacional",Yes,FemArt,,,https://www.metmuseum.org/press-releases/2025-commissions-2025-exhibitions,Convocatoria,Visuales
Convocatoria La Micrera 2025 para microrrelatistas,"Convocatoria ""La Micrera 2025"" en Chile",,https://www.recursosculturales.com/la-micrera/,Chile,"February 24, 2025","concurso de microrrelatos, convocatoria de microrrelatos, microrrelatos",Yes,Micrera,,,https://www.recursosculturales.com/la-micrera/,Convocatorias,"Literatura, Publicaciones"
Aurora Borealis: Artists Residency Programme 2025 (Italy),"Residencia ""Aurora Borealis 2025"" en Italia",Revisar,https://on-the-move.org/news/aurora-borealis-artists-residency-programme-2025-italy,,"February 23, 2025",,No,On The Move,,,,Residencia,
"Held Together: Fragility & Endurance in Art, Virtu...","Convocatoria ""Held Together: Fragility & Endurance in Art"" en",Revisar,https://visionaryartcollective.submittable.com/submit,,"February 23, 2025",,No,Visionary Art Collective,,,,Convocatorias,
"Mostra FemArt 2024-2025 ""No me cuida la historia, me cuidan las archivas""","Convocatoria ""Mostra FemArt 2024-2025"" en España",,https://www.arteinformado.com/agenda/f/mostra-femart-2024-2025-no-me-cuida-la-historia-me-cuidan-las-archivas-233848,España,"February 23, 2025",Exhibición,Yes,Arte Informado,,,https://www.exibart.es/evento-arte/convocatoria-mostra-femart-2024-2025/,Convocatorias,"Visuales, fotografía, Artes"
"Open Call: ""Under All Is The Land"" by Woman Made G...","Convocatoria ""Under All Is The Land"" en Italia",Revisar,https://www.artjobs.com/open-calls/call-artists/italy/22652/plastic-visions,,"February 22, 2025",,No,Plastic Visions,,,,Convocatoria,
"""Color"" An Exhibition at Decode Gallery","Convocatoria ""COLOR"" en el mundo",Revisar,https://decodegallery.com/color,,"February 22, 2025",,No,Decode Gallery,,,https://decodegallery.com/color,Convocatoria,
"Virtual Exhibition: ""Impermanence"" by Art Fluent","Convocatoria ""Impermanence"" en EEUU",,https://art-fluent.com/calls-for-art/impermanence-prospectus/,EEUU,"February 22, 2025","Arte, Convocatorias, Exposición Virtual",Yes,Art Fluent,,,https://art-fluent.com/calls-for-art/impermanence-prospectus/,Convocatoria,Visuales
Open Call: Home Based Program (Residencia en Barce...,"Residencia ""Home Based Program"" en Barce...",Revisar,https://www.esrarobarcelona.com/como-aplicar-barcelona,,"February 21, 2025",,No,Esra Ró Barcelona,,,,Convocatoria,
Open Call March 2025: “Metamorphosis: Transformati...,"Convocatoria ""Metamorphosis Transformaciones en Arte"" en todo el mundo",Revisar,https://bushwickgallery.com/open-call-march-2025-metamorphosis-transformations-in-art/,,"February 21, 2025",,No,Bushwick Gallery,,,https://bushwickgallery.com/open-call-march-2025-metamorphosis-transformations-in-art/,Convocatoria,
OPEN CALL  / RESIDENCIA EPECUÉN,"Residencia ""Epecuén"" en todo el mundo",Revisar,https://app.datarte.art/convocatorias/residenciaepecuen,,"February 21, 2025",,No,Residencia Epecuén,,,https://residenciaepecuen.com.ar/open-call/,Convocatoria,
Open Call: Three-Person Exhibition in Spring 2025,"Convocatoria ""Obtener Disciplina"" en EEUU",,https://www.space776.com/open-call,EEUU,"February 21, 2025","Convocatorias, oportunidad para artistas",Yes,Space776,,,https://www.space776.com/open-call,Convocatoria,VIsuales
"Residencia de creación en ARTS ITOYA (Saga, Japón)","Residencia ""ARTS ITOYA"" en Japón",,https://artsitoya.com/apply/,Japón,"February 21, 2025","oportunidad para artistas, programa de residencia, residencia de artistas",Yes,ARTS ITOYA,,,https://artsitoya.com/,Residencia,Visuales
"Wiener Festwochen: In the Field Programme for Emerging Artists and Cultural Workers (Austria) ","Convocatoria ""Wiener Festwochen Field Programme"" en Austria",Revisar,https://on-the-move.org/news/wiener-festwochen-field-programme-emerging-artists-and-cultural-workers-austria,,"February 20, 2025",,No,Wiener Festwochen,,,,Oportunidad,
A Turma: InResidence 2025 Artist Residency for Playwrights or Theatre Makers (Portugal),"Residencia ""InResidence 2025"" en Portugal",Revisar,https://on-the-move.org/news/turma-inresidence-2025-artist-residency-playwrights-or-theatre-makers-portugal,,"February 20, 2025",,No,On The Move,,,,Residencia,
Tartu City of Literature: Residency for Writers and Translators 2025 (Estonia),"Residencia ""Tartu City of Literature"" en Estonia",Revisar,https://on-the-move.org/news/tartu-city-literature-residency-writers-and-translators-2025-estonia,,"February 20, 2025",,No,Tartu City of Literature,,,,Residencia,
"Open Call: ""Human Expressions 2025"" by Maryland Fe...","Convocatoria ""Human Expressions"" en Estados Unidos, Canadá y México",Revisar,https://mdfedart.com/portfolio/human-expressions/,,"February 20, 2025",,No,Maryland Federation of Art,,,https://mdfedart.com/exhibitions/,Convocatoria,
"Pan-Adria: Fellowship for Contemporary Dance Productions in Adriatic, Pannonian and/or Alpine regions 2025/2026 ","Beca ""Pan-Adria Fellowship Danza Contemporánea"" en Adriático, Pannoniano y/o Alpino",Revisar,https://on-the-move.org/news/pan-adria-fellowship-contemporary-dance-productions-adriatic-pannonian-andor-alpine-regions,,"February 20, 2025",,No,On-the-Move,,,https://zagrebackiplesnicentar.hr/en/pan-adria-network/,Oportunidad,
Fanak Fund: NURUS Programme Mobility Grants Focused on Environmental Issues,"Beca ""Fanak Fund: NURUS Mobility Grants"" en el mundo",,https://on-the-move.org/news/fanak-fund-nurus-programme-mobility-grants-focused-environmental-issues,,"February 20, 2025",Fondo,No,NURUS Programme,,,https://on-the-move.org/topics/environment-sustainability,Fondos,Multidisciplinar
VII Certamen de creación para artistas emergentes,"Convocatoria ""VII Certamen Creación Artistas Emerg."" en España",,https://app.datarte.art/convocatorias/certamen-creacion-artistas-emergentes-2025,,"February 20, 2025",,No,Datarte,,,https://www.uloyola.es/actividades/servicio-de-cultura-formacion-complementaria/crea-loyola/certamen-artistas-emergentes,,
