,,SALÓN DE ARTES VISUALES DEL MUSEO DEL CCLF 2024: L...
Eco Artist Interviews,,Insights of an Eco Artist Interviews
Certamen Zurbarán,,V Certamen de Pintura Juan de Zurbarán
,,SPIE International Day of Light Photo Contest 2024
,,Featured Artist | Showcase Your Art On Our Interna...
,,Open Theme Juried Art Competition
Concurso Pintura E. Goday,,XII Concurso de Pintura Ernesto Goday
7th WEA Prize 2024,,7th Annual Women's Emerging Artist Prize 2024
VI Premio ATC Impulsa,,2024 VI PREMIO ATC IMPULSA
Blu-Sky Artist Awd,,Blu-Sky Artist Award (BSAA)
CINEMATICS PICTURES,,CINEMATICS PICTURES
Small Works 2024,,Small Works 2024
"Art, Diseño o Fotografía",,"Art, Design or Photography Residency Program (Méxi..."
Img Reg 10,,Imagen Regional 10
IX Conc. Fotografía Terror 2024,,IX Concurso de Fotografía de Terror 2024
MINI PRINT REUS FORTUNY 2024,,MINI PRINT INTERNACIONAL REUS FORTUNY 2024
Artísticas Int. 2024,,Programa de Residencias Artísticas Internacionales
,,The 2024 International Interdisciplinary Art Confe...
EWA Art Prize,,THE EMERGING WOMAN ARTIST AWARD ART PRIZE
Gibbs St. RA 2024-2025: Free,,"Gibbs Street Resident Artists 2024-2025: Free, Ope..."
,,V Premio Internacional de Carteles MAKMA ‘Sostenib...
,,Neither Here Nor There
LUCIE SCHOLARSHIP,,2024 LUCIE SCHOLARSHIP PROGRAM
Premios Hexagonal,,I Premios Hexagonal de Innovación & Creación Artís...
Exhibición en el Metaverso,"Arte Digital, Exhibición en el Metaverso, Metaverso",SOLO EXHIBITION IN THE METAVERSE
Art for Change Prize,,ART FOR CHANGE PRIZE
RENASCENCE II – Art Emergente,"Arte Emergente, Nuevas Artes, exposición de arte",RENASCENCE II – New and Emerging Art
Museo Preus Open Call 2024 -> Museo Preus,,Museo Preus Open Call 2024
Comp. Fotografía Global,,GLOBAL FINE ART PHOTOGRAPHY COMPETITION
Arte: Comida + Todo,,Art Inspired by: FOOD + Everything About it
,,Challenge 143: Cityscapes
Esencia de conexiones,,The essence of connections
Apoyo a la Creación '24. Producción,,Apoyo a la Creación '24. Producción
,,Surreal Visions
2024,,Residencias 2024
Cerámicas Precolombinas,,Pre-Columbian Ceramics Instructional Residency Pro...
5° Conc. Int. Fotografía,,5° CONCURSO INTERNACIONAL DE FOTOGRAFÍA: POSTALES ...
Factory AiR,"Factory AiR, oportunidad para artistas, residencia de artistas",Factory AiR Application
2024 Fotografía Show & Venta,,2024 Annual Juried Photography Show & Sale
,,Designed to Dwell
Premio Pintura Paco Merino,,19º. Premio de Pintura Paco Merino
,,ENDLESS SUMMER 2024 - Online All Media Exhibit
1er Bienal Internacional Grabados,,PRIMER BIENAL INTERNACIONAL DE GRABADOS “MANUEL BO...
II Premio de Fotografía Paisaje Giennense,,II PREMIO DE FOTOGRAFÍA SOBRE EL PAISAJE GIENNENSE
,,Peruvian Textiles Instructional Residency Program ...
PKF Grnts,oportunidad para artistas,PKF Grants
,,SculptFest24- Call to Artists
,,Residency Program
Decolonizando Feminismo,,Through a BIPOC Lens: Decolonizing Feminism
,,THE ALMENARA ART PRIZE 2024
III Ed. Fotografía Alberto Galán,,III EDICIÓN BECA DE FOTOGRAFÍA ALBERTO GALÁN
LOMA SERENA,LOMA SERENA,LOMA SERENA
Certamen Pintura Ramón Córdoba,,CERTAMEN DE PINTURA AL AIRE LIBRE RAMÓN CÓRDOBA 20...
,,Natural Pigments Instructional Residency Program (...
Call for Art - minimal,,Call for Art- minimal
,,XXIV CERTAMEN NACIONAL DE PINTURA “ADOLFO CÓRDOBA”...
Premi Escultura Fundació Bosch Aymerich,,Premi d’Escultura Fundació Bosch Aymerich
Collage Art en Escocia,,Collage Artist Residency in Scotland
OPEN CALL: THE HUMAN BODY,,OPEN CALL: THE HUMAN BODY
Patio Talento Flora Instalación Flora,,CONVOCATORIA PATIO TALENTO FLORA INSTALACIÓN FLORA...
Instalación Artística Temporal,,TEMPORARY OUTDOOR PUBLIC ART INSTALLATION
Mexican Ceramics,"oportunidad para artistas, programa de residencia, residencia de artistas",Mexican Ceramics Residency Program
,,Beca d'Arts Visuals Fundació Güell - 2024
East London Art Prize 2025,,The East London Art Prize 2025
,,Residencias de Producción
,,International Juried Photography Call for Entry: A...
WTP MAG: ARTS,Artes Visuales,WTP MAGAZINE: VISUAL ARTS
INVIERNO-PRIMAVERA 2024,,OPEN CALL INVIERNO-PRIMAVERA 2024
,,XLII CERTAMEN INTERNACIONAL DE PINTURA CASTILLO DE...
,,Politically Charged: Call to Artists
,,YEARBOOK AWARDS 2024
Exhibir en Mattie Kelly Arts,,EXHIBITING AT THE MATTIE KELLY ARTS CENTER
Premio Eurostars Fotografía,,PREMIO EUROSTARS HOTEL COMPANY DE FOTOGRAFÍA DE MÁ...
Printmkg Rsdncy,"oportunidad para artistas, programa de residencia, residencia de artistas",Printmaking Residency Program
Tokyo Open Art,,Tokyo Open Art
Dora Maar House Artists,"oportunidad para artistas, programa de residencia, residencia de artistas",Fellowships: Dora Maar House Artists Residency
,,Open Theme Online Art Competition
,,Production and research residency program in the P...
Certamen Indalecio Hernández,,XXVIII CERTAMEN DE PINTURA INDALECIO HERNÁNDEZ VAL...
Baron Book Prize,"Concurso de Libros, Premio Literario, Premio de Literatura",The Baron Book Prize
,,Open Call: Programa de Pasantías Argentina Perform...
TERRA EARTH - EXHIBICIÓN VIRTUAL,,“TERRA EARTH” - A VIRTUAL EXHIBITION
,,Festival Internacional de Artes Digitales de Tesal...
JIA Ilus. Award 2024,,JIA Illustration Award 2024
Electroetching Inst.,"oportunidad para artistas, programa de residencia, residencia de artistas",Electroetching Instructional Residency Program
,,
Art Res. B.Aires 2024,residencia de artistas,Art Residence Program based in Buenos Aires
Feria de Arte al Norte de México -> FAMA 2024,," Feria de Arte al Norte de México"
The Artist Series - AE,,The Artist Series - American Express
Premio Arte Cinético,,"Premio de Arte Cinético "
Orillas Nuevas,innovación,Orillas Nuevas abrió la convocatoria
Artistas,"Residencia para artistas, oportunidad para artistas, programa de residencia",Programa de Residencias para Artistas
Creación,Becas para artistas,Becas a la Creación 
,,Residencias Artísticas R.A.R.O.  
Residencia Artística en España -> Res. Artística España,,Residencia artística en España
,,Residencia Epecuén
Fotoperiodismo Ian Parry,fotografía,Beca de Fotoperiodismo Ian Parry (IPPG) para fotógrafos jóvenes y emergentes
Premio Literario Kindle 2024,Premio Literario,Amazon convoca al Premio Literario Kindle Storyteller 2024
Epecuén,,Residencia Epecuén / Prácticas Artísticas en Territorio
Convocatoria Festivales Cinematográficos,Cine,Ministerio de Cultura convoca ayudas para organización de festivales y certámenes cinematográficos (España)
Mostra Igualada 2024,Artes Visuales,Mostra Igualada 2024 – Feria de espectáculos infantiles y juveniles
Cartel “¡Cometiendo Errores!”,Diseño Gráfico,Posterheroes convoca para diseño de cartel con el tema “¡Cometiendo Errores!”
2024 CPA Juried Exhibition,"Arte, convocatoria, fotografía",Center for Photographic Art Call for Entries: 2024 CPA International Juried Exhibition
Grito de Mujer 2024,,Convocatoria Grito de Mujer 2024 Para Poetas y Artistas
"Cafè Tissardmine, Marruecos","Cafe Tissardmine, Marruecos, Residencia para artistas","Cafe Tissardmine, residencia para artistas en Marruecos"
,,Orillas Nuevas: Programa de Apoyo a las Industrias Culturales y Creativas en Argentina
"La casita del Lago, Lago hermoso, Neuquén, Argentina",,"Residencia “La casita del Lago” en Lago hermoso, Neuquén, Argentina"
B-Murals,"B-Murals Residencies, Open Call B-Murals Residencies, Residencias",Open Call B-Murals Residencies
Convocatorias,Convocatorias,/SWITCHLANGUAGE/TO/ARTEALDIA_COM_USER/CONVOCATORIAS
,,/CONVOCATORIAS
Arte Laguna Prize,Artistas,ARTE LAGUNA PRIZE CONVOCATORIA PARA ARTISTAS Y DISENADORES
Convocatoria Digital Perú AE,Arte Digital,CONVOCATORIA ABIERTA PARA ARTISTAS DIGITALES EN PERU UNA INICIATIVA DE AMERICAN EXPRESS
,,"10 Becas abiertas de arte, investigación y estudio en el extranjero"
Premio No Ficción Asteroide,Premio Literario,Convocatoria al Premio de No Ficción Libros del Asteroide
Certamen Novela Corta,Premio Literario,Certamen Nacional de Novela Corta “Roger De Conynck” (México)
Danza a Escena 2025,Danza,Convocatoria a compañías para Danza a Escena 2025 (España)
Premio Fotografía Luis V.,fotografía,Premio Internacional de Fotografía Humanitaria Luis Valtueña 2024
Innovate Grant,"Subvenciones trimestrales, recursos culturales",Innovate Grant apoya a artistas y fotógrafos a través de subvenciones trimestrales
,fotografía,Head On Photo Awards | Open for Entries | convocatoria abierta
Concurso Pintura y Dibujo FPMC,Artes Visuales,Concurso VIII Edición concurso de pintura y VII Edición concurso de Dibujo y Grabado FPMC
Buitbox,Artistas,Las Cigarreras abre la convocatoria Buitbox para el desarrollo de proyectos culturales
Sony Future Filmmkr Awards,Cine,Sony Future Filmmaker Awards ofrece oportunidades a creadores y cineastas
Convocatoria BDSM FF Barcelona,"BDSM Film Festival, Barcelona, convocatoria, exposición colectiva",Convocatoria exposición Colectiva para el BDSM Film Festival de Barcelona
Concurso microrrelatos AI,Premio Literario,Concurso de microrrelatos de Amnistía Internacional “Escribir por derechos”
Premio Peabody 2024 - Música,Música,"Premio Peabody a las Artes abre su convocatoria 2024, con temática música"
Green Prod Award: convocatoria ecológica,Convocatoria de productos y conceptos ecológicos,Green Product Award: convocatoria de productos y conceptos ecológicos
Premio Dramaturgia Invasora,teatro,Convocatoria abierta al Premio Internacional Dramaturgia Invasora
Royal Photographic Society,fotografía,Royal Photographic Society abre su convocatoria de becas para proyectos
Waka Kuyuy,teatro,Residencia Intercultural en Artes Escénicas Waka Kuyuy
Suralita SURAM,,Suralita abre su convocatoria SURAM para música y mediación cultural en Manacor
Centro De Arte FMJJ 2024,"Centro De Arte FMJJ, Residencias Artísticas",Residencias Artísticas Internacionales Centro De Arte FMJJ 2024
Fundación Ama Amoedo,Becas Fundación Ama Amoedo,Becas Fundación Ama Amoedo
,,Artistas latinoamericanos en residencia
Becas Complemento Directo -> Compl. Directo,,Programa de Becas Complemento Directo
Convocatoria Hijas del Arte 2024,Becas de perfeccionamiento,Convocatoria Comunidad 2024 Hijas del Arte
Premio http://ca.sa/ 2024,Artistas,Premio Ca.Sa 2024
Concurso Artes Mediales y Audiovisuales Juan Downey,,Concurso de Artes Mediales y Audiovisuales Juan Downey
Un Balcón y Un Árbol,residencia de artistas,Residencia Un Balcón y Un Árbol
Taller de Videomapping en Resolume Arena,,Taller de Videomapping en Resolume Arena
Premio Fotografía Arte x Arte,fotografía,Premio de Fotografía Arte x Arte 2024
Premio AAMEC Fotografía Contemp.,fotografía,Premio AAMEC de Fotografía Contemporánea Argentina
Premio PAM Artista Mujer 2024,Becas para artistas mujeres,Premio PAM Artista Mujer 2024
Formación en Nueva Ópera,Artistas,Becas Seminario Intensivo de Formación en Nueva Ópera
Dir. Arg. Creativa,Gestión,Convocatoria al Directorio Argentina Creativa (DAC)
Humanidades Ambientales,Becas De Grado,Humanidades Ambientales en el cruce del Arte y la Tecnología
Congreso Internacional de Archivos Audiovisuales de Arte,residencia de artistas,Congreso Internacional de Archivos Audiovisuales de Arte
Ext. Deadl. Amaz. Peruana,residencia de artistas,EXTENDED DEADLINE Residencia en la Amazonía Peruana
Hijas del Arte Proyectos Expositivos,convocatoria,Buscamos proyectos expositivos en Argentina
,convocatoria,Buscamos artistas en Argentina
"Expo virtual ""PINCTUM""",convocatoria,"Exposición internacional virtual ""PINCTUM"""
Salón Otoño Fotografía,fotografía,Salón de Otoño de Fotografía
IV Certamen Libro Artista,convocatoria,IV CERTAMEN DE LIBRO DE ARTISTA
VIII CONCURSO PINTURA Y DIBUJO,Artes Visuales,"VIII CONCURSO DE PINTURA, DIBUJO Y GRABADO"
Mural en Serbia (artistas cat.),Open Call B-Murals Residencies,Mural en Serbia (solo artistas catalanes)
Producción obra artistas arg.,"Becas para artistas visuales, Producción de obra para artistas",Becas para producción de obra para artistas argentinas
Exposición Arequipa 2024,Artes Visuales,"Exposición en Arequipa, Perú"
"Arequipa, Perú",Becas de residencia,"Residencia en Arequipa, Perú"
Maestría y doctorado en Universidad Lingnan,,"Becas de maestría y doctorado en la Universidad de Lingnan en Hong Kong, China"
"Grado en Sharda Univ, India","Becas De Grado, India, maestría y doctorado en Sharda University","Becas de grado, maestría y doctorado en Sharda University, India"
Chandigarh Univ,"Becas De Grado, maestría y doctorado en Chandigarh University en India","Becas de grado, maestría y doctorado en Chandigarh University en India"
Ibermúsicas,,Becas Ibermúsicas de apoyo a profesionales del sector musical en Iberoamérica
Estudios OEA,"Becas Académicas de Posgrado de OEA, Becas De Grado, Becas de Intercambio, Becas de OEA, Becas de posgrado, Programa Regular de OEA",Becas para estudios académicos de OEA
Move La América,"Becas de Maestría, Becas de doctorado, Brasil","Becas ""Move La América"" para maestrías y doctorados en Brasil"
Marie Skłodowska-Curie redes doctorales UE,,Becas Marie Skłodowska-Curie para redes doctorales en la Unión Europea
Posgrados Rice Univ,"Becas de posgrado, Estados Unidos, Rice University","Becas de posgrado en Rice University, Estados Unidos"
Circulación Internacional de Obras de Teatro,"Circulación de Obras Teatrales, Instituto Nacional del Teatro, Teatro Internacional",Programa de circulación internacional de obras de teatro del Instituto Nacional del Teatro
DAAD EPOS Alemania,,Becas del DAAD para maestría o doctorado del Programa EPOS en Alemania
Dcto. en Univ. Palermo,"Becas de doctorado, Italia, Università Degli Studi di Palermo",Becas de doctorado en la Università Degli Studi di Palermo en Italia
Doc. Uni Camerino Italia,Becas de doctorado en la Università di Camerino en Italia,Becas de doctorado en la Università di Camerino en Italia
Posdoc UCL Bélgica,"Becas posdoctorales, Bélgica, Université Catholique de Louvain",Becas posdoctorales en la Université Catholique de Louvain en Bélgica
DAAD Música Alemania,,Becas del DAAD para maestría en Música en Alemania
DAAD para investigaciones largas en Alemania,,Becas del DAAD para investigaciones largas en Alemania
Arte Laguna Prize 19ª Ed.,,19th Edition Arte Laguna Prize
,,Printmaking Barcelona Residency Program
W. Eugene Smith Grant,,The W. Eugene Smith Grant
EXPANDIR PINTURA,,"EXPANDIR LA PINTURA  -  Investigación, experimenta..."
,,Open Call: Orange
,,Printmaking Artist-In-Residence Program
Orillas Nuevas,,Orillas Nuevas: Programa de Apoyo a las Industrias...
"8th ""P, T & F"" Art Comp",,"8th Annual ""Patterns, Textures & Forms"" Online Art..."
UNREAL & NON-REPRESENTATIONAL 4,,"UNREAL & NON-REPRESENTATIONAL 4 i.e., ABSTRACT Jur..."
Raymond James Gasparilla Fest,,Raymond James Gasparilla Festival of the Arts
Chalk Hill Artist,,Chalk Hill Artist Residency Program
XXIX Bienal E. Sempere 2024,"Bienal Mediacity Seúl, Premio Internacional, exposición colectiva",XXIX BIENAL DE PINTURA EUSEBIO SEMPERE- 2024
EPECUÉN Site-Specif.,,RESIDENCIA EPECUÉN Site-Specific Program
Nuevo Artista,,Boomer Gallery CFE: The New Artist
Key West Art & Craft Fest,,Key West Art & Craft Festival
Convocatoria Artistas Visuales,,Convocatoria para Artistas Visuales - Agenda Expos...
,,COMUNITARIA: RESIDENCIA DE ARTE CONTEMPORÁNEO Y PR...
Grants for Artists & Photogs,,"﻿Grants for Artists and Photographers"
2024 Art Awards,,2024 American Art Awards
,,VI Bienal Arte Atuel en Cerámica Escultórica y Dib...
Women's Work 2025,,"""Women's Work"" 2025"
Poniendo el pie,,Putting My Foot Down
"Exhibición: ""Art Is""",,CICA Museum International Exhibition: “Art Is”
Color,,Open Call: Colour
Hypatia-in-the-Woods,,Hypatia-in-the-Woods Residency
XVIII Conc. Pintura Agua Granada,,XVIII CONCURSO DE PINTURA AGUA GRANADA
14th Online Art Comp,"competencia de arte en línea, concurso de arte, exposición de arte",14th Annual “Open” Online Art Competition
ON::VIEW Artist,,ON::VIEW Artist Residency
,,3rd Edition Daniele Tamagni Grant 2024-2025
Halloran Art Prize,"Certamen Nacional, Premio Internacional de Fotografía, Premio de arte digital",The Halloran Contemporary Art Prize
Taller video exp. auto,,"La Idea Continúa - Taller de video expandido, auto..."
"""JOY"" Exh. 2024",,"""JOY"" National Juried Exhibition 2024"
9th Annual Landscapes Art Comp,,9th Annual Landscapes Art Competition
14th Annual “Animals” Art Comp,,14th Annual “Animals” Online Art Competition
Verano de nuestras vidas III,,"3ª edición de ""El verano de nuestras vidas"""
Golden Found.,,The Golden Foundation Residency Program
,,The Fred Oldfield Juried Art Exhibition
Silence Awareness Existence,,Silence Awareness Existence - Thematic residency p...
,,Got Art?
UNO A UNO - Clínica de obra,,UNO A UNO - Clínica de obra - individual
Public Art Billboard Series,,Future Vision: Public Art Billboard Series + Exhib...
VI Premio ATC Impulsa,,VI Premio ATC Impulsa
TPOTY Awards 2024,,Travel Photographer of the Year Awards 2024
BABESTU. Creación contmp.,,BABESTU. Programa de apoyo a la creación contempor...
,,Open Call: Dark
Premio Nacional Cerámica,,17º Premio Nacional de Cerámica Ciudad de Castelló...
Vashon Artist,,Vashon Artist Residency
Convocatoria AVA,,OPEN CALL: ASSOCIATION FOR VISUAL ARTS
IV Cert. Nac. Pintura RCM,,IV Certamen Nacional de Pintura Del Real Club Medi...
Andy Rocchelli Grant,"Premio Internacional, Residencia para artistas, oportunidad para artistas",Andy Rocchelli Grant
,,Edición #4 Residencia Pastizal
Art Critique,,Art Critique Program
11th OPEN Intl Art Comp,,11th OPEN International Juried Art Competition
G&Ms 2024,,Gods & Monsters 2024
Bloedel Rsv,,Bloedel Reserve Creative Residency
Exhibición Fotográfica Internacional,,International Juried Photography Exhibition: THE S...
Tartget Prize Pintura,,Tartget Prize International Painting Contest
Premio Almuzara Pintura,,III PREMIO ALMUZARA DE PINTURA
6th WATER Art Comp.,,6th WATER International Juried Art Competition
10th Leaves & Petals Art Comp,,10th Annual Leaves & Petals Art Competition
10th Annual Figures & Faces Art Comp,,10th Annual Figures & Faces Art Competition
100 West - Corsicana Artist,,100 West - Corsicana Artist & Writer Residency
XXIII Conc. Nac. Pintura Sotillo,,XXIII CONCURSO NACIONAL DE PINTURA VILLA DE SOTILL...
Summer Dreams Art Chlg,,Summer Dreams Art Challenge
Arte: Voces y Visiones,,Arte: Voces y Visiones para la transformación
Convocatoria 2024,,CONVOCATORIA COMUNIDAD 2024
III Ed. Cert. Nacional Artes Pl.,,III EDICIÓN CERTAMEN NACIONAL DE ARTES PLÁSTICAS C...
Selección Artista CAT,,CONVOCATORIA PARA LA SELECCIÓN DE UN/A ARTISTA CAT...
,,Bienal Tridimensional Juan Ramón Bonilla 2024
AGAC 2024: Desata tu Creatividad,,AGAC 2024: Unleash Your Creativity
Premio Bienal Artes Visuales,,Premio Bienal de Artes Visuales Áreatec 2024 7° ed...
Aviário Studio LF,,Aviário Studio Large Format Residency
Certamen Pintura Montellano,,XXXIII CERTAMEN DE PINTURA “VILLA DE MONTELLANO”
Carmignac Photojournalism Aw.,,Carmignac Photojournalism Award 2024
Premio Pintura Joven 2024,,Premio Fundación Ibercaja de Pintura Joven 2024
Emo,,Open Call: Emotion
PASSEPARTOUT PHOTO PRIZE,,PASSEPARTOUT PHOTO PRIZE – 9TH EDITION
Premio Boghossian,,The Boghossian Foundation Prize
Global Photography Awards 2024,,The Global Photography Awards 2024
B-MURALS 2025,,RESIDENCIAS B-MURALS 2025
Dorland Mtn Arts,,Dorland Mountain Arts Residency
9th Waterscapes Art Comp,,9th Annual Waterscapes Art Competition
XVI Cert. Pintura Nocturna,,XVI CERTAMEN DE PINTURA RÁPIDA NOCTURNA “VILLA DE ...
Colectiva Contemp.,,CONVOCATORIA PARA EXPONER EN LA “COLECTIVA CONTEMP...
,,2024 Pacific States Biennial North American Juried...
8th COLOR Intl Art Comp,,8th COLOR International Juried Art Competition
Certamen Pintura Villaviciosa,,XXVII CERTAMEN NACIONAL DE PINTURA DE VILLAVICIOSA
,,Lush: Group Exhibition
XVI Certamen Internacional Fotografía,,XVI CERTAMEN INTERNACIONAL DE FOTOGRAFIA ASISAFOTO...
Main St Gallery Art Show & Sale,,Main Street Gallery 2024 Fine Art Show & Sale
Millay Arts Core,,Millay Arts Core Residency
Certamen Creaciones Joven,"Certamen Creaciones Joven, Certamen Nacional, Premio Internacional, convocatoria",XVIII CERTAMEN TRANSFRONTERIZO DE CREACIONES JÓVE...
Certamen Arte Luarca,"Certamen Nacional, Premio Internacional, convocatoria",LV CERTAMEN INTERNACIONAL DE ARTE DE LUARCA (CNAL)
Concurso Fotográfico Nature,Premio Internacional de Fotografía,NATURE AND HUMANS CONCURSO FOTOGRÁFICO
,"Arte, Concurso, Premio Internacional de Fotografía",2024 Paris Photo–Aperture PhotoBook Awards
Exhibición Fotográfica,,Across America - Photography Exhibition
"Elem: Tierra, Fuego, Agua, Aire",convocatoria,"Elemental: Earth, Fire, Water, Air"
Spotlight Awards 2024,,Spotlight Awards 2024
ANBA-Selú producción obra artista,"Becas para artistas, Producción de obra para artistas, programa de residencia",Becas ANBA-Selú de producción de obra para artista...
Premios Fotografía Europea,Premio Internacional de Fotografía,EUROPEAN PHOTOGRAPHY AWARDS
Trillium Arts,"Residencias Artísticas, oportunidad para artistas, residencia de artistas",Trillium Arts
14th PleinAir Salon Art Comp,,14th Annual PleinAir Salon Online Art Competition
,,Concurso de Artes Gráficas “Los Colores de la Salu...
,Residencia para artistas,Artist Residency at Edgewood Farm
Bennett Prize 4.0,premio de arte,The Bennett Prize 4.0
,,Aviário Studio Multidisciplinary Residency
Premio Gredos Pintura 2024,,XLV edición del Premio Gredos de Pintura 2024
KHN,"KHN Residency, oportunidad para artistas, residencia de artistas",KHN RESIDENCY
VII Mini Print Intl Cantabria,"Cantabria, Internacional, Mini Print",VII MINI PRINT INTERNACIONAL CANTABRIA
Paz/Conflicto,convocatoria,Peace/Conflict
Green Olive Arts,"oportunidad para artistas, programa de residencia, residencia de artistas","Green Olive Arts Residency in Tetouan, Morocco"
XI Premio Ankaria Libro Artista,Convocatoria Premio Ankaria,XI Premio Ankaria Libro de Artista. Convocatoria 2...
Día de Muertos,,DAY OF THE DEAD
Zari Art Prize Comp.,convocatoria,Zari Art Prize Competition
,"Residencia para artistas, oportunidad para artistas, programa de residencia",McColl Center Artist-in-Residence Program
Art Hist o Cult Res,"Residencia artística interdisciplinaria, programa de residencia, residencia de artistas",Art History or Cultural Research Residency Program...
Premio Fotografía Badajoz 2024,"Convocatoria de Pintura, Premio Exposición Colectiva, Premio Internacional de Fotografía",11 PREMIO DE FOTOGRAFÍA CIUDAD DE BADAJOZ 2024
CONNECT,Premio Internacional,Call for Entry: CONNECT
Carmignac Photojournalism 15th,,The 15th edition of the Carmignac Photojournalism ...
Wet Paint 2024,convocatoria,"""Wet Paint"" 2024"
,Premio Internacional,Forma. Espais d’art contemporani Balaguer - 2024
Amarillo,convocatoria,Open Call: Yellow
Full Circle: Vel. de Luz,,Full Circle: The Speed of Light
8° Conc. Abierto Pintura,"Concurso de Pintura, Convocatoria de Pintura",8° CONCURSO ABIERTO DE PINTURA
,,Call for Artists
Gallery 4%: Contest Figurativo,Premio Internacional,Gallery 4%: Figurative Contest
Colectiva de Arte Co...,,"Convocatoria para exponer en ""Colectiva de Arte Co..."
Premio Jaén Pintura 2024,"Premio Internacional, Premio Internacional de Fotografía, Premio de Escultura",XXXVIII PREMIO JAÉN DE PINTURA EMILIO OLLERO 2024
Llamado a Artistas: Pintura Original,"convocatoria de artistas, llamado a artistas, pintura original",Call For Artists: Original Painting
2024 CPA Int'l Juried Exhibit,Premio Internacional de Fotografía,2024 CPA International Juried Exhibition
IACA Mini-Grnts,oportunidad para artistas,IACA Mini-Grants
Proy. COIL Gob. Méx.,,Becas de proyectos COIL del Gobierno de México
B-MURALS 2024,,Residencia con B-MURALS
Multi-Conv.,Residencia para artistas,Multi-Residencia
H. Based Prg.,Programa de Residencia en Casa,Home Based Program
Investigación artística,"Investigación, Programa de investigación artística, Residencias Artísticas",Programa de investigación artística
Il Posto Primavera 2024,"Beca de Investigación Il Posto, Beca de investigación",Beca de Investigación Il Posto Primavera 2024
Visión y Presencia,"Arte, convocatoria, oportunidad para artistas","Convocatoria Visión y Presencia, Uruguay"
Concurso Baetón,"Concurso, Concurso Baetón, convocatoria",Concurso Baetón
Premio Azcuy,Premio Internacional,Convocatoria Premio Azcuy
Taller video expandido,,"Taller de video expandido, autobiografía y performance"
Convocatoria Bienal Arte Visual,"Arte, Convocatorias, Premio Internacional",Convocatoria Bienal Internacional de Arte Visual Universitario
Convocatoria Orillas Nuevas,,Convocatoria Orillas Nuevas. Nouveaux Rivages
Solanas Art Experience,"Convocatorias, Premio Internacional, Residencias Artísticas",Convocatoria Solanas Art Experience
Premio Galicia Fotografía 2024,"Arte, Premio Internacional de Fotografía, recursos culturales",Premio Galicia de Fotografía Contemporánea 2024
Spencer Foundation subvención,"Spencer Foundation, investigación en educación, subvenciones en educación",Spencer Foundation subvenciona proyectos de investigación en educación
Premio SM Lit Inf El Barco 2024,Premio SM de Literatura Infantil,Premio SM de Literatura Infantil El Barco de Vapor 2024
Premio Artez Blai Investigación,"Investigación, Premio Internacional, artes escénicas",Premio Internacional Artez Blai de Investigación sobre las Artes Escénicas
