OPEN CALL Passa cá em casa,,OPEN CALL PROJETOS ARTÍSTICOS | Culturgest
,,arterialab.uevora.pt
,,Novo programa de apoio aos agentes culturais da região Centro com candidaturas abertas
,,RedeMore_open call #strictlyworkinprogress_EN+PT.pdf
,,iCoDaCo
,,REGULAMENTO 2024_ REGULATION_BOLSAS NO TEATRO DA VOZ.pdf
,,"Se organiza, artista"
CIRCLE Women Doc Accel.,Artistas,CIRCLE Women Doc Accelerator | Training Initiative
,,Clarão
Candidaturas DGARTES,,Candidaturas Abertas | DGARTES
,,DGARTES abre Apoio Sustentado Bienal com mais 15 milhões que no ciclo anterior | DGARTES
,,Showcase 2024 - Candidaturas abertas para edição presencial | Outdoor Arts Portugal
,,Góis Oroso Arte 2024
"Bolsa ""Agora o Folk!"" - PédeXumbo",,OPEN CALL Bolsa «Agora o Folk!» – PédeXumbo
Fuso Insular Lab,Fuso Insular Laboratorio,Fuso
,,Regulamento Premio MJFontainhas.pdf
C. Europe MEDIA,"Artistas, oportunidad para artistas, programa de residencia",Creative Europe MEDIA
,,Prémios Mais a Norte
Criar,,Criar
Cultura y Creatividad,"Artificial Intelligence, innovación",Home - Culture and Creativity
,,Regulamento – Passaporte
,,Google Forms: Sign-in
TNDM,Dramaturgos,www.tndm.pt
,,Regulamento_Y EMERGENTES OPEN CALL 2024.pdf
PASS | La Toscanini,Compositores,PASS | International Open Call for Composers | La Toscanini
,,"Curso de Verão do Arquipélago – Arquipélago – Centro de Artes Contemporâneas    "
Museo Coruche,Museu de Coruche,Museu de Coruche
STARTS4WaterII,"Artistas, Residencia para artistas, oportunidad para artistas",STARTS4WaterII – Open Call for Artists – S+T+ARTS
,,"
	LAAR
"
Premio Lit. Infantojuvenil Manuel Lopes,Prêmio Literário Infantojuvenil Manuel Lopes,Abertas candidaturas ao Prémio Literário Infantojuvenil Manuel Lopes - Imprensa Nacional
Premio José Luís Peixoto,Premio Literario,"Prémio Literário José Luís Peixoto "
Prémio Fndções,Premio Internacional,Prémio Fundações
Pasantías Argentina Performance Art,,CONVOCATORIA ABIERTA PROGRAMA DE PASANTIAS EN ARGENTINA PERFORMANCE ART
Residencia Casa Alberto Heredia,Residencia para artistas,CONVOCATORIA PARA RESIDENCIA DE ARTISTAS EN CASA ALBERTO HEREDIA
Convocatoria Fundación AMA,Artistas,CONVOCATORIA ABIERTA DE BECAS DE LA FUNDACION AMA AMOEDO
13A Bienal Mediacity Seúl,"Artistas, Bienal Mediacity Seúl, convocatoria",LA 13A BIENAL MEDIACITY DE SEUL ABRE CONVOCATORIA PARA DIRECTOR ARTISTICO
Convocatoria Artistas 2025,"Academia de Estudios Coreanos, Alemania, Argentina, Artificial Intelligence, Artistas, Becar Cultura, Becas Académicas de Posgrado de OEA, Becas De Doctorado del Gobierno de Italia, Becas De Grado, Becas Saint-Exupéry, Becas Técnicas, Becas UNESCO, Becas Unilaterales, Becas de Integración Regional, Becas de Intercambio, Becas de Maestría, Becas de Movilidad, Becas de OEA, Becas de conciertos, Becas de doctorado, Becas de doctorado en la Universidad de Lingnan en Hong Kong, Becas de doctorados, Becas de estudio, Becas de idioma del Gobierno de Rusia, Becas de investigación, Becas de investigación doctoral, Becas de investigación en Reino Unido, Becas de la Iniciativa Jóvenes Líderes de las Américas en Estados Unidos, Becas de la Universidad Hangyang en Corea del Sur, Becas de la Universidad de Curtin en Australia, Becas de la Universidad de Nottingham, Becas de la University College Cork en Irlanda, Becas de posgrado, Becas del Gobierno de Italia, Becas del Ministerio de Ciencia e Innovación de España, Becas del Programa Fondo Oportunidades, Becas del Programa Internacional de Líderes Visitantes en Estados Unidos, Becas del Smart Loire Valley Programme en Francia, Becas doctorales, Becas en Australia, Becas en China, Becas en España, Becas en Estados Unidos, Becas en Francia, Becas en Malasia, Becas en la Akademie Schloss Solitude, Becas en la Unión Europea, Becas externas, Becas para artistas, Becas para artistas visuales, Becas para diplomados, Becas para estudios de grado, Becas para investigadores, Becas para maestrías, Becas para posgrado, Becas posdoctorales, Becas posdoctorales Marie Skłodowska-Curie en la Unión Europea, Bienal Mediacity Seúl, CONICET, Canadá, Chandigarh University, Chile, China, China Scholarship Council, Comisión Fulbright, Comisión Fulbright-CONICET, Compositores, Cooperación Sur-Sur, Corea del Sur, Curaduría, Dramaturgos, EducationUSA, Escuela de Estudios Avanzados en Ciencias Sociales en Francia, España, Estados Unidos, Estados Unidos de América, Estancias cortas posdoctorales, Estudiantes de música, Fondos de investigación en Reino Unido, Formación en Artes, Fundación Carolina, Fundación Cisneros, Fundación Getty, Fundación Pollock-Krasner, Fundación Santander, Giras musicales, Global Challenges, Gobierno de Italia, Gobierno de Nueva Zelanda, Gobierno de Qatar, Gobierno de Suiza, Grado, Historia del Arte, Hong Kong, Imprensa Nacional, India, Iniciativa Jóvenes Líderes de las Américas, Internacional, International Baccalaureate Diploma, Investigación, Investigación Rutas de la Seda, Irish Research Council, Irlanda, Italia, Japón, Kenkyuryugaku, Marie Curie, Marie Skłodowska-Curie, Ministerio de Capital Humano, Museo MoMA, Naciones Unidas, OEA, Posgrado, Premio Internacional, Premio Internacional AI, Profesorado Argentino, Programa Escala Estudiantil, Programa Regular de OEA, Programa de Cooperación Técnica, Programa de becas, Proyectos de colaboración internacional, Proyectos internacionales, Prêmio Literário Infantojuvenil Manuel Lopes, R.A.R.O, Residencia de bailarines, Residencia para artistas, Residencias ACE, Residencias Artísticas, Revista Magenta, SFER IK Museion, Senshugakko, Sharda University, Suiza, Talleres para artistas, The British Academy, Universidad Hangyang, Universidad Howard, Universidad Nacional Autónoma de México, Universidad de Calabria, Universidad de Deakin, Universidad de Friburgo, Universidad de Lingnan, Universidad de Lingnan en Hong Kong, Universidad de Macau, Universidad de Ottawa, Universidad de Thammasat, Universidad de Tongji en Shanghái, University College Cork, Università degli Studi di Salerno, Unión Europea, convocatoria, innovación, investigadores, maestría y doctorado del Gobierno de Rumania, maestría y doctorado del Gobierno de Turquía, maestría y doctorado en la Universidad de Macau en Hong Kong, oportunidad para artistas, programa de residencia, residencia de artistas",CONVOCATORIA ABIERTA PARA EL PROGRAMA DE RESIDENCIA DE ARTISTAS 2025
Convocatoria Ciencia Tecnología y Sociedad,Becas de Intercambio,CONVOCATORIA ABIERTA CIENCIA TECNOLOGIA Y SOCIEDAD
PINTA BAPHOTO 20,Artistas,PINTA BAPHOTO CONVOCA A GALERIAS PARA SU EDICION NUMERO 20
PINTA MIAMI 2024,"Arte, PINTA MIAMI 2024, convocatoria",PINTA MIAMI 2024 CONVOCATORIA ABIERTA
FUND AMA AMOEDO Y CASA WABI,Artistas,CONVOCATORIA FUNDACION AMA AMOEDO Y CASA WABI
ICPNA ARTUS WIELS 2024,,BECA ICPNA ARTUS WIELS CONVOCATORIA 2024 EN PERU
4ta EDICIÓN ALA ART PRIZE,,CONVOCATORIA ABIERTA CUARTA EDICION DEL ALA ART PRIZE
Formación Arte Ciencia y Tecnología 2024,,PRESENTE CONTINUO CONVOCATORIA 2024 DEL PROGRAMA DE FORMACION DE ARTE CIENCIA Y TECNOLOGIA
,convocatoria,EL BROOKLYN MUSEUM ANUNCIA UNA CONVOCATORIA ABIERTA PARA PARTICIPAR EN UNA GRAN EXPOSICION
Pastizal Llamado Final,,RESIDENCIA PASTIZAL LLAMADO FINAL PARA APLICAR
Convocatoria en Blanco de Espacio El Dorado,,ULTIMOS DIAS CONVOCATORIA EN BLANCO DE ESPACIO EL DORADO
Fundación Alex Brown,,PROGRAMA DE ARTISTAS RESIDENTES DE LA FUNDACION ALEX BROWN
Fundación SOM y MAK Center,,PROGRAMA DE RESIDENCIA PARA INVESTIGADORES DE LA FUNDACION SOM Y EL MAK CENTER
AUTO ITALIA BUSCA DIRECTOR,,AUTO ITALIA BUSCA DIRECTOR
Convocatoria Director Bienal Berlin,,CONVOCATORIA ABIERTA PARA DIRECTOR DE LA BIENAL DE BERLIN
MF Convocatoria Int. 2024,,MATTRESS FACTORY ABRE CONVOCATORIA INTERNACIONAL 2024
The New Centre,,SOLICITUDES DE BECAS DE THE NEW CENTRE FOR RESEARCH PRACTICE
Convocatoria de Investigación Curatorial,,CONVOCATORIA DE BECAS DE INVESTIGACION CURATORIAL
10a EDICION DE CONCENTRICO,,CONVOCATORIA DE PROPUESTAS CONCURSOS DE LA 10A EDICION DE CONCENTRICO
ART EXPLORA 2024,,CONVOCATORIA DE CANDIDATURAS ART EXPLORA PROGRAMA DE RESIDENCIA 2024
Convocatoria en NY para exposiciones en Apexart,convocatoria,CONVOCATORIA ABIERTA EN NUEVA YORK PARA EXPOSICIONES COLECTIVAS EN APEXART
SFer IK Museion,,CONVOCATORIA ABIERTA SFER IK MUSEION CONVOCA UN NUEVO PREMIO PARA ARTISTAS
Convocatoria SpreePark Art Space Berlin,,CONVOCATORIA ABIERTA DE RESIDENCIA ARTISTICA EN SPREEPARK ART SPACE BERLIN
ART OMI Convocatoria Arq.,,ART OMI CONVOCATORIA ABIERTA DE RESIDENCIA DE ARQUITECTURA
Convocatoria Curador Global Art Jameel,,CONVOCATORIA ABIERTA DE CURADOR GLOBAL EN ART JAMEEL
Dir. Artístico C.C. Belem,,CONVOCATORIA PARA DIRECTOR ARTISTICO EN EL CENTRO CULTURAL DE BELEM
FRAME ART FINLANDIA,,FRAME CONTEMPORARY ART FINLANDIA CONVOCATORIA DE BECAS DE INVESTIGACION CURATORIAL
Ibermúsicas 2024 ayudas,Artistas,Ibermúsicas abrió sus convocatorias 2024 de ayudas al sector musical
Ayudas IBERESCENA 2024/25,Artistas,El Programa IBERESCENA abrió su convocatoria de Ayudas 2024/2025
Mov. int. cultura Esp. 2024,Recursos,Guía sobre movilidad internacional para cultura desde y en España 2024
Arte Laguna Prize 19,Artistas,Concurso de Arte en Venecia – Arte Laguna Prize 19
Fotografía humanística W. E. Smith,fotografía,Beca anual en fotografía humanística del W. Eugene Smith Memorial Fund
Howard Chapnick Grant,fotografía,"The Howard Chapnick Grant para proyectos de edición, investigación, educación y gestión en fotografía"
Sony World Photo Awards 2025,fotografía,Sony World Photography Awards abre su convocatoria 2025
Premio Biblioteca Breve 2025,"Novela inédita, Premio Internacional, convocatoria",El Premio Biblioteca Breve abre su convocatoria para novela inédita 2025
Premios Pilar Juncosa 2024,Educación Artística,"Premios y Becas Pilar Juncosa 2024 para edición, formación y proyectos de educación artística"
ITSLIQUID Supernatural,"ITSLIQUID Supernatural, convocatoria, recursos culturales",ITSLIQUID anuncia la convocatoria abierta para SUPERNATURAL
Ibermúsicas: especialización,Educación Artística,Ibermúsicas: ayuda a la especialización y el perfeccionamiento artístico y técnico
Proyecto´ace,Residencia para artistas,Programa de residencias artísticas Proyecto´ace
Ciclo de teatro Universo Bebés,convocatoria,Ciclo de teatro Universo Bebés convoca grupos de artes escénicas
Premio Traducción Literaria,Traducción,III Premio Hispanoamericano de Traducción Literaria Aquelarre Ediciones
Fund. Ama Amoedo Artistas,Residencia para artistas,"Becas Fundación Ama Amoedo para artistas, compromiso social, organizaciones y publicaciones"
Ibermúsicas 2024,Artistas,Ibermúsicas abre convocatoria de ayuda a la programación musical 2024
Encuentro sobre Conservación de Arte,Documentación,"Encuentro Nacional sobre Registro, Documentación y Conservación de Arte Contemporáneo"
Anba-Selú producción obra artistas,"Anba-Selú, Becas para artistas mujeres, Producción de obra para artistas",Becas Anba-Selú de producción de obra para artistas mujeres
"Jiser 2024-2025 Sousse, Argel, Barcelona",Residencia para artistas,"Residencias Jiser de creación 2024-2025 en  Sousse, Argel y Barcelona"
,Residencia para artistas,Ibermúsicas abre convocatoria de ayuda a instituciones para residencias
Becas Semillero -> Semillero,Becas para artistas,Becas Semillero
Convocatoria Conservación Arte Cont,"Conservación de Arte Contemporáneo, Encuentro Nacional",Convocatoria Conservación de Arte Contemporáneo
Subvenciones Cultura Alicante 2024,convocatoria,Convocatoria de Subvenciones 2024 Concejalía de Cultura de Alicante
Convocatoria Fragmentos,convocatoria,Apertura Convocatoria Fragmentos
Convocatoria Investigación Situada 24-25,Becas de investigación,Convocatoria de proyectos de investigacion situada 24 25
Premio Art for Change 2024,"Premio Art for Change 2024, Saatchi Gallery","Premio Art for Change 2024, Saatchi Gallery"
"Convocatoria Magnum, Textile Transformations 2024",Arte Textil,"Convocatoria Magnum, Textile Transformations 2024"
Concurso Videocreación,Videoarte,"Concurso de Videocreación, Posthumanamente hablando"
Fundación Ama Amoedo 2° ed.,,Becas Fundación Ama Amoedo 2° edición
Cobertizo,Beca Cobertizo Residencia de artistas,Beca Cobertizo Residencia de artistas
Premio Escultura Fund. Bosch,"Fundació Bosch Aymerich, Premio de Escultura","Premio de Escultura, Fundació Bosch Aymerich"
Moving Narratives,Cine,"Convocatoria Moving Narratives, Prince Claus Fund"
Semillero 2024,"Becas SEMILLERO 2024, convocatoria",Convocatoria abierta Becas SEMILLERO 2024
Convocatoria Jiser 2024-25,convocatoria,Convocatoria Residencias Jiser 2024-2025
Máster Artes SUR-UC3M,Maestría,"Matrícula abierta, Máster en Artes SUR-UC3M"
Lab Proceso Creativo Ananké Asseff,Residencia para artistas,Laboratorio De Proceso Creativo de Ananké Asseff
Preservación Patrimonio AV 2024,Patrimonio,Apoyo a la Preservación del Patrimonio Audiovisual 2024
Taller Entre Cyborgs y Robots... Arte,"Artistas, Residencia para artistas, Talleres para artistas",Taller Entre cyborgs y robots… Arte
Pasantías 2024-2025,"Hipermedula, Pasantías 2024-2025, Programa de Pasantías",Programa de Pasantías 2024-2025
Farsa Contemp.,,"Farsa Contemporánea, Residencia de Arte"
Prêmio Territórios Tomie Ohtake,Artistas,Prêmio Territórios Tomie Ohtake
"Bolsa ZUM/IMS, prod. art. cont.","Becas para artistas, Producción de obra para artistas, arte contemporáneo","Bolsa ZUM/IMS, produção artística contemporânea"
,,México: ¿Qué estamos traduciendo?
,,R.A.R.O. Bogotá
,,2024 CCI Artist Fellowship
Taller Escritura CCI x C&,,Taller de escritura crítica de CCI x C& (EN LÍNEA)
Ancestralidades 2024 - Medio Ambiente y Raza,,Programa Ancestralidades de valorização à pesquisa 2024 – meio ambiente e raça
CIMAM 2024,Curadores,CIMAM 2024 Call for Travel Grant Applications
,,science_technology_society
,,Chamada Programa Hélio Oiticica - 2ª edição
,,7ª Edição do Edital de Concurso Folhetaria Ateliê Aberto do CCSP
,,21ª edição do Território da Arte de Araraquara
,,"Funk, Arte e Resistência"
,,Diáspora Africana no Brasil 2024
,,BF24 – Bienal de Fotografia de Vila Franca de Xira
,,Pátio Aberto 2024
,,Laboratório de pesquisa MAM São Paulo
ARVDC 2024,,La Residencia de Artistas Virtuales Digitales del Caribe 2024
,,Edital de Cultura Sesc RJ Pulsar 2025
ArtRio 2024,,ArtRio 2024
Fundación Williams y Gob. Francés,Becas de Intercambio,Fundación Williams y Gob. Francés: proyectos en la Argentina.
The Bennett Prize,,CALL FOR ENTRIES The Bennett Prize
"La Nave, Escobar (Proyecto PAC)",,"Residencia artística en La Nave, Escobar La Nave (Proyecto PAC)"
,,"Residencia artística en La Nave, Escobar"
Bennett Prize,,CALL FOR ENTRIES
XXII EXPO MUNDOA,Premio Exposición Colectiva,XXII EXPOSICIÓN INTERNACIONAL MUSEO VIRTUAL MUNDOA...
II PREMIO DE ESCULTURA FUNDACIÓN BOSCH AYMERICH 20...,"Premio de Escultura, escultura",II PREMIO DE ESCULTURA FUNDACIÓN BOSCH AYMERICH 20...
III Premio Internacional Grabado,,III Premio Internacional de Grabado de Castilla- L...
IHRAM Calls & Submissions,Convocatorias,IHRAM Publishes / Calls & Submissions
Visual Arts Grants,,Visual Arts Grants
RE:POP 2024,arte contemporáneo,RE:POP 2024
2025 EXHIBIT,Artes Visuales,2025 EXHIBIT
,"oportunidad para artistas, programa de residencia, residencia de artistas",Venice Artist Residency
Invisibilidad: Periferia,Artes Visuales,Invisibility: Existing on the Periphery
Barcelona Open Art,arte contemporáneo,Barcelona Open Art
Jan Van Eyck,,RESIDENCY
Luz Sensible,,CALL FOR WORK – LIGHT SENSITIVE
Fiberart Int'l 2025,,Fiberart International 2025 Open Call
,,Future Stars: 5th Edition
SUGi x NAVA Fotografía 2024,fotografía,SUGi x NAVA Photography Contest 2024
UCROSS,Residencia para artistas,UCROSS RESIDENCY PROGRAM
,,2025 RESIDENCIES
,residencia artística,FotoCreativaBA | Residencia Artística 2024
Org. Paint. Instr.,,Organic Painting Instructional Residency Program
Feria Intl Arte Capital,"Arte, Convocatorias, Feria Internacional",Convocatoria 2a Feria Internacional Arte Capital
,"oportunidad para artistas, programa de residencia, residencia de artistas","Artist in Residence Program in Fukuoka, Japan"
Show of Heads,,A Show of Heads
Conc. Fotografía Naturaleza,"Concurso Fotografía Naturaleza, Premio Internacional de Fotografía, exposición colectiva",THE NATURE PHOTOGRAPHY CONTEST
XXIX Bienal Pintura Paterna,,XXIX BIENNAL DE PINTURA VILA DE PATERNA 2024
OPEN CALL: PLANET EARTH,,OPEN CALL: PLANET EARTH
Premio Internacional de Fotografía,"Esperanza Pertusa, IV Edición, Premio Internacional de Fotografía",IV Edición Premio Internacional de Fotografía Espe...
La Puebla 2024,,Residencias artísticas La Puebla de Cazalla 2024
Convocatoria Proy. Expositivos,"Proyectos expositivos, Universidad, convocatoria de proyectos expositivos",Convocatoria de Proyectos Expositivos Universidad ...
Comp. Intern. de Arte 2024,,International Open Art Competition 2024
Micro R.,,Micro Residencias
Nature's Palette Exhibit,Artes Visuales,“Nature’s Palette” Juried Exhibition
Secret Salon IV,,The Secret Salon IV
,,Convocatoria a las Becas Joan Miró
Art On Loop Tky,exposición de arte,Art On Loop Tokyo
Fotografía 4 Humanity 2024,,Photography 4 Humanity 2024
P. Palimpsesto: Pintura Mural,,Proyecto Palimpsesto: Residencia de Pintura Mural
Aplicación Artística,,RESIDENCY APPLICATION
MacDowell Sp/Sum 2025,,MacDowell Residency Spring/Summer 2025
Int. Residence,Residencia para artistas,INTERNATIONAL RESIDENCE PROGRAM
Exploración ACE,,Residencias de Exploración
Anthology Photo Comp 2024,"Premio Internacional de Fotografía, concurso de fotografía, exposición colectiva",Anthology Photography Competition 2024
Exhibición de Naturaleza,,Nature Exhibit
"Convocatoria ""Confabulaciones""","ACTIVACIONES EN DI, Confabulaciones, convocatoria","Convocatoria ""Confabulaciones"": ACTIVACIONES EN DI..."
Lab 2024,programa de residencia,The Lab Program 2024
Critic's Spotlight: Artists,,Critic’s Spotlight: Artists Opportunity
Retratos,Artes Visuales,Call For Entry: The Portrait
IV Certamen Pto Final,,IV Certamen Punto Final
OPEN CALL 2024,Convocatoria Abierta,OPEN CALL 2024
Concurso Pintura Puçol,,XXXIX Concurso de Pintura Vila de Puçol
Litografía Centro Edición,,Residencias Litografía Centro de Edición de Buenos...
Nat Ink Silkscreen Inst.,,Natural Ink Silkscreen Instructional Residency Pro...
Concurso Fotográfico AMG 2024,,XXXI CONCURSO FOTOGRÁFICO ANDRES MUÑOZ GARDE 2024
Artist Rsdncy,Residencia para artistas,Artist Residency
Explorando Espacios Domésticos,,Exploring Domestic Spaces
FUTURISTIC VISIONS,FUTURISTIC VISIONS Fine Art Competition,FUTURISTIC VISIONS Fine Art Competition
2a Feria Intl Arte Capital,"Arte Capital, Exposición Internacional de Arte, Feria Internacional de Arte",2a Feria Internacional Arte Capital
Premios Mallorca Fotografía 2024,,Premios Mallorca de Fotografía Contemporánea 2024
Concurso Cartel Anunciador SNAC,,CONCURSO CARTEL ANUNCIADOR DE LA SEMANA NACIONAL D...
I Biennal de Gravat M. Boix,,I BIENNAL DE GRAVAT MANUEL BOIX
Arte y Comunidades,arte contemporáneo,DC COMMISSION ON THE ARTS & HUMANITIES | FY25 PUBL...
Premi Pintura Tat Vilà 2024,Artes Visuales,Premi Pintura Tat Vilà 2024
Premio Escultura Badajoz 2024,,18 PREMIO DE ESCULTURA CIUDAD DE BADAJOZ 2024
LensCulture Art Awards 2024,,LensCulture Art Photography Awards 2024
Fi2025,Artistas,Fiberart International 2025 (Fi2025)
II Salón Virtual de Fotografía con Imagen y/o Intervención Textil,fotografía,II Salón Virtual de Fotografía con Imagen y/o Inte...
Artadia Awards 2024,Artadia Awards 2024,Artadia Awards 2024
,fotografía,Abandoned
Anthology Art Comp 2024,"competencia de arte, concurso de arte, premio de arte",Anthology Art Competition 2024
Sea Change,arte contemporáneo,Open Call: Sea Change
27º Premio Diario de Burgos de Pintura Rápida,Artes Visuales,27º Premio Diario de Burgos de Pintura Rápida
Self-Directed,Residencia para artistas,Self-Directed Residencies
Artes Visuales 2025 / Alianza Francesa Lima,Artes Visuales,ARTES VISUALES 2025 / ALIANZA FRANCESA DE LIMA
Artistas 2025,"Residencia para artistas, oportunidad para artistas, programa de residencia",2025 Artists Residency Program
Eden Hope Artist,Residencia para artistas,Applications Open Now
Concurso Cartel Fira Tots Sants 2024,Concurso del cartel anunciador de la 678 edición d...,Concurso del cartel anunciador de la 678 edición d...
IAREX l'ATELIER OPEN CALL,"IAREX l'ATELIER, convocatoria internacional, residencia artística",IAREX l'ATELIER OPEN CALL
Miniprint Intl Galicia 2024,,II Miniprint Internacional Galicia 2024
Art Fair Zurich,"Feria de Arte, Zúrich, arte contemporáneo",THE CONTEMPORARY ART FAIR IN ZURICH
HIPA 2024,fotografía,HIPA 2024 – International Photography Award
Ama Amoedo 2024,,Open Call 2024: Becas Fundación Ama Amoedo
Convocatoria Fragmentos 2024,,Convocatoria Fragmentos. Proyecto artístico 2024
Ucross Fndtn,Residencia para artistas,Ucross Foundation’ Residencies
Comp. Internac. Ilustración 2024,,"2024 International Illustration Competition ""Art o..."
"Exhibición: Aviones, Trenes y Autos",,"Planes, Trains and Automobiles Exhibit"
Preus Museum Open Call 2024,arte contemporáneo,Preus Museum Open Call 2024
Monochromatic Awards 2024,fotografía,Monochromatic Awards 2024
ARTCABBAGE PRIZE,,ARTCABBAGE PRIZE
Premio Arte Digital Jaume Graells,,XXVIII Premio de Arte Digital Jaume Graells
Sony World Photo Awards,"Sony World Photography Awards, concurso de fotografía, fotografía",The Sony World Photography Awards
,,2025 Fall Artist-in-Residence Open Call September ...
XI Cert. Nac. Esc. San Bartolomé,"Certamen Nacional, San Bartolomé, escultura",XI CERTAMEN NACIONAL DE ESCULTURA DE “SAN BARTOLOM...
Fondo Artes Vicente López,convocatoria,FONDO MUNICIPAL DE LAS ARTES DE VICENTE LÓPEZ
Visitantes 2024,,Visitantes 2024
,,Temporary Public Art Program
AMS Weather Band Photo Contest,,AMS Weather Band Photo Contest 2024
,,Expression in Plein Air 2024
XXI Cert. Int. Fotografía Pat.,,XXI CERTAMEN INTERNACIONAL DE FOTOGRAFÍA SOBRE PAT...
13ª Bienal Mediacity Seúl,,LA 13ª BIENAL MEDIACITY DE SEÚL ABRE CONVOCATORIA ...
6th VH AWARD,"Premio Internacional, Residencia para artistas, oportunidad para artistas",The 6th VH AWARD for Emerging Asian Media Artists
Exhibición individual,,SOLO EXHIBITION PROPOSALS
15th Epson Pano Awards,Artes Visuales,The 15th Epson International Pano Awards
Certamen Hugo Padeletti,Artistas,CERTAMEN HUGO PADELETTI
Convocatoria Rdhf,arte contemporáneo,CONVOCATORIA ABIERTA PARA EL PROGRAMA DE RESIDENCI...
VII BIENAL INT. DE PINTURA 2024,Pintura,VII BIENAL INTERNACIONAL DE PINTURA 2024: ‘LOS SAN...
,,Art On Loop: Toronto
VIII Cert. Nac. Pintura Torreón,,VIII CERTAMEN NACIONAL DE PINTURA “CIUDAD DE TORRE...
Artista 2025,,ARTIST RESIDENCY PROGRAM
,,Gold Leafing & Estofado Instructional Residency Pr...
XVII SNAC 2024,Artes Visuales,XVIIº SALON NACIONAL DE ARTE CONTEMPORÁNEO 2024
Premio Pintura Badajoz 2024,,17 Premio de Pintura Ciudad de Badajoz 2024
,"Artista virtual, programa de residencia, residencia artística",Virtual Artist in Residence Program
Fieldhouse Act.,convocatoria,Fieldhouse Activation Program
Formas Rotos,,BROKEN FORMS
THIS LAND,Residencia para artistas,THIS LAND
Premio Práctica Museística,,Premio a la Práctica Museística Destacada
Art Quilts,,Call for Work: Art Quilts
9º Conc. Int. Fotografía,,9º CONCURSO INTERNACIONAL DE FOTOGRAFÍA
Xposure Intl Photo & Film Awards,,Xposure International Photography & Film Awards 20...
Int. Art Prize 2024,Premio Internacional,International Art Prize 2024
Expresiones Otoñales,,Autumn Expressions
DC Arts Center Open Call,"Open Call, arte contemporáneo, convocatoria",DC ARTS CENTER OPEN CALL FOR WALLMOUNTABLES (2024)
Artista en 2025,,2025 Fall Artist-in-Residence Open Call
IV Certamen Arte Contemp,arte contemporáneo,IV CERTAMEN DE ARTE CONTEMPORÁNEO SALVADOR VICTORI...
ZI · Quién puede vivir aquí?,"oportunidad para artistas, residencia, residencia artística",ZI · Residencia: Quién puede vivir en esta casa?
Paris Open Art,,Paris Open Art
,programa de residencia,Open Call: PAR Art Residence Program 2024
Cultivate Art Mag,fotografía,Call for Submissions for the Cultivate Art Magazin...
WALK & TALK ARTIST RESIDENCY,,WALK & TALK_ONE WEEK ONLINE ARTIST RESIDENCY
Foundry Gallery Artists' Choice: 2024 Regional Jur...,arte contemporáneo,FOUNDRY GALLERY ARTISTS’ CHOICE: 2024 REGIONAL JUR...
NeoFeminist Crtv Rsdncy,Residencia para artistas,THE NEOFEMINIST CREATIVE RESIDENCY
HUMANS LANDSCAPES,"Arte Digital, Becas de Intercambio",HUMANS LANDSCAPES
,,Becas Producción expositiva fotográfica
Art for Change Prz 2024,Premio Internacional,Art for Change Prize 2024
FARSA CONTEMPOR...,"Residencia para artistas, oportunidad para artistas, programa de residencia",PROGRAMA DE RESIDENCIA ARTÍSTICA  “FARSA CONTEMPOR...
SINOPIA 2024,Residencia para artistas,SINOPIA Residency Summer Program 2024
ARTCABBAGE PRIZE,,ARTCABBAGE PRIZE OPEN INTERNATIONAL JURIED ART COM...
Textiles Mex,,Mexican Textiles Instructional Residency Programs
Awesome Fndtn,,The Awesome Foundation
XX Cert. Pintura Contemp.,,"XX Certamen de Pintura Contemporánea ""Casimiro Bar..."
WABI-SABI 2024 - Fotografía,"Online Photography Exhibit, WABI-SABI 2024",WABI-SABI 2024 – Online Photography Exhibit
Premio Arte Bello Bizarre 2024,Premio Internacional,Beautiful Bizarre Art Prize 2024
Innuendo,Artistas,Innuendo
Art Fair East 2024,,Open call 2024 Art Fair East
,,Residency at GlogauAIR in Berlin
