Photostory: Walk of Water,"Walk of Water, concurso de fotografía, concurso de fotostory",Photostory contest: Walk of Water - Water Towers
Your Way Online Solo Exh.,"arte contemporáneo, convocatoria de exposición, exposición en línea",Your Way Online Solo Exhibition
Substand. St.: J. Morris & Ross,"Johnny Morris Road, Ross Road, Substandard Streets",Substandard Streets: Johnny Morris Road & Ross Roa...
Escenas de la Vida Real,convocatoria,Open Call: Scenes From Real Life
EMERGENCE(Y) Open Call,"Open Call, Premio Internacional, convocatoria",Science Gallery Melbourne: EMERGENCE(Y) Open Call
Elisabet Ney Museum Grounds,Residencia artística Elisabet Ney,"Open Call: ""Elisabet Ney Museum Grounds - AIPP Pro..."
Formas y Figuras,"Arte, convocatoria, exposición colectiva","""Forms and Shapes"" Juried Art Exhibition"
Premio Crítica Joven AICA,"Premio Crítica Joven AICA, Premio Internacional, convocatoria",Convocatoria Abierta: Premio Crítica Joven AICA 20...
14th Nature Art Comp,"arte de la naturaleza, competencia de arte, concurso de arte en línea",14th Annual “Nature” Online Art Competition
"""Anything & Everything Art Contest""","concurso de arte, convocatoria de arte","Open Call Juried Art Contest: ""Anything & Everythi..."
Orange Open Call Art,Orange Open Call Art,Orange Online Open Call for Art
Wintertime: Intl Photo Exhibit,"Arte, Premio Internacional de Fotografía, exposición colectiva",Wintertime: International Photography Exhibition
Premio Peabody Diseño Argentino,,"Premio Peabody al Diseño Argentino: “Más allá del Presente, Diseño el futuro próximo”"
F.E.R.A. - Feira de Edições,,"Pedra Dura - Festival de Dança do Algarve on Instagram: ""OPEN CALL - PUBLICAÇÕES

A Apneia Colectiva convida artistas da região do Algarve a submeterem as suas publicações no campo das artes performativas para a 2ª  F.E.R.A. - FEIRA DE EDIÇÕES REALIZADAS POR ARTISTAS.
O evento acontece no âmbito do Pedra Dura - Festival de Dança do Algarve, dia 9 de Novembro, às 10h30,  na Praça do Infante em Lagos. 
A F.E.R.A. consiste numa mostra de publicações das artes performativas contemporâneas, em que se apresentam artistas que fazem do registo das suas práticas e vivências artísticas um meio de produção de pensamento e partilha na esfera pública. 
Nesta 2ª  edição queremos promover o encontro entre os autores e o público, com pequenas ativações performativas das publicações e uma conversa sobre os processos de criação das publicações.
Deste modo, convidamos artistas que vivem e trabalham na região do Algarve a apresentarem as suas publicações. Para participar, envia uma manifestação de interesse com um link ou PDF da publicação e uma sinopse para: apneiacolectiva@gmail.com (assunto: FERA OpenCall_nome autor) 

Data limite : 11 de Outubro de 2024
Nº participantes Locais: 4
Cachet: 80€ 

//

OPEN CALL 

Apneia Colectiva invites artists from the Algarve region to submit their publications in the field of performing arts to the second FAIR OF EDITIONS MADE BY ARTISTS.
The event takes place within the scope of Pedra Dura, on November 9th at 10:30 am, at Praça do Infante in Lagos. 
The F.E.R.A. consists of a fair of contemporary performing arts publications, featuring artists who use the recording of their artistic practices and experiences as a means of producing thought and sharing in the public sphere. 
In this 2nd edition we want to promote a meeting between authors and the audience, with small performative activations of publications and a conversation about the work.
We invite artists who live and work in the Algarve region to present their publications. To part..."
Forma.BRABA,,Open Call: Forma.BRABA
Criação 2025,,Bolsa de Criação 2025 - Candidaturas abertas até 15 novembro 2024 | Outdoor Arts Portugal
Common LAB 2025,,Open Call — Common LAB 2025
,,Convocatória para intervenções artísticas (a preto e branco) na Rua da Restauração 
Atlas Artístico e Cultural,,Atlas Artístico e Cultural de Portugal | DGARTES
Índice Redes Culturales,,Índice de Redes Culturais | OPAC
Arte Sem Barreiras,,Arte Sem barreiras - Fundação GDA
Open Call | O Espaço do Tempo,,Open Call | O Espaço do Tempo
Eça de Queiroz 3ª Ed.,,"
	
	Bolsas de Residência Literária Eça de Queiroz - 3ªEdição

"
"Oficina ""Estado Bruto""",,"Oficina ""Estado Bruto: da Faísca da Ideia ao Movimento de Criação"" por Chaiana Furtado"
Airtable App Platf,,Airtable | Everyone's app platform
"Se Organiza, Artista! Podc",,"Se Organiza, Artista! Podcast"
"Se Organiza, Artista!",,"Se Organiza, Artista! (@seorganiza.artista) on Threads"
Open Door Nineteen Exhibit,"Juried Exhibition, Rosalux Gallery",Open Door Nineteen Juried Exhibition at Rosalux Ga...
Exhibición Automat 2024,,Automat Collective: 2024 Open Call Exhibition
Exhibición Propuestas,"arte contemporáneo, convocatoria de propuestas, exposición",Open Call For Exhibition Proposals at Well Well Pr...
"""Trauma & the ...""","Art Journal, Submissions","Art Journal Call For Submissions: ""Trauma and the ..."
18th St. Local Artist,,18th Street Local Artist Residency
Magic Moment Art Contest,,Omi Art Gallery: “Magic Moment” Art Contest and Ex...
"""Forma Natura: Nature as Sou""",,"New Call For Entries: ""Forma Natura: Nature as Sou..."
International Artist Open Call,"Open Call, concurso de arte, convocatoria internacional","International Artist Online Magazine Open Call: ""I..."
Exhibición: Realidades Borrosas,"Arte, Exhibición, Open Call",Exhibition Open Call: Blurred Realities
,,Contemporary Art Room Gallery: 7th “Abstract” Onli...
Salón Textil Internacional,,I Salón Textil Internacional Territorios al Sur (A...
Gottlieb Emerg. Grant,,The Adolph & Esther Gottlieb Emergency Grant
Art Center Dover: Contemp. Abstr.,,The Art Center in Dover: Contemporary Abstract Jur...
Premio Eurostars Fotografía,,XXII Premio Eurostars Grand Marina de Fotografía 2...
Cista Arts: Plataforma Emergente,,"Cista Arts: Open Call for ""Platform for Emerging A..."
Edutainment Prod. Inc.: Instal.,,"Edutainment Productions Inc.: ""Installing our Futu..."
4th Annual Juried Exhibition,,"4th Annual Juried Exhibition: ""Children of Men 202..."
Concurso de Arte “Viznarte”,,III Edición del Concurso de Arte “Viznarte” 2024-2...
Great Am Nudes,,Open Call: Great American Nudes
Premio AEDAS Homes Pintura,,I Premio AEDAS Homes de Pintura de la Ciudad de Va...
New Emergence Art Prize 2024,,The New Emergence Art Prize 2024
Explorando Espacios Domésticos,"Espacios Domésticos, Juried Exhibition, Open Call",Open Call: “Exploring Domestic Spaces” Juried Exhi...
Jóvenes Artistas Canarios 2024,,Becas 2024 para Jóvenes Artistas Canarios
Exposición Internacional,,Convocatoria internacional de Exposición para Ilus...
"Exhibición AI ""Future?""","Arte Digital, Premio Internacional, Residencias Artísticas","""Future?"" Juried AI Art Exhibition"
"Convocatoria arte ""El Retrat""","arte plástica, convocatoria de arte, retrato","XIII Convocatoria de arte plástica tema ""El Retrat..."
ArtExpress Art Sanctuary Comp.,,ArtExpress Art Sanctuary International Competition
Jiser 2024-2025,"Residencias, oportunidad para artistas, programa de residencia",Residencias Jiser 2024-2025
CEWE Photo Award 2024,concurso de fotografía,CEWE Photo Award 2024
III Conc. Int. Esc. ICRE: Transf.,"Concurso Internacional de Escultura, Transformación, escultura",III Concurso Internacional de Escultura ICRE: Transformación
FotoCreativaBA 2024,,FotoCreativaBA Residencia Artística 2024 [Member of Res Artis]
Tartget Prize,"Concurso Internacional de Pintura, Premio Internacional de Fotografía, Tartget Prize",Tartget Prize. Concurso Internacional de Pintura
XI Premio Eurostars Fotografía,,XI Premio Eurostars Madrid Tower de Fotografía
Concurso carteles 2025,"arte contemporáneo, concurso de carteles, exposición de arte",EXPOPeregrina2025 - Concurso de carteles
Concurso Arte Creadoras 2024-25,"Concurso, Premio Internacional de Fotografía, arte contemporáneo",II Concurso de Arte Contemporáneo Creadoras 2024-2025 - Transformaciones: Humanidad
Premio AICA Crítica 2024,"Premio Internacional, Premio Literario, convocatoria",Premio AICA de la Crítica 2024
Arte Intruso 2025,Convocatoria Arte Intruso 2025,Convocatoria Arte Intruso 2025
Premio Silos Fotografía,"Arte, Premio Internacional de Fotografía, exposición colectiva",6ª Edición Premio Silos de Fotografía
Call for Entries #31,"Open Call, convocatoria internacional, llamado a artistas",Call For Entries #31
EXPOPeregrina2025,"EXPOPeregrina, arte contemporáneo, convocatoria de obras",EXPOPeregrina2025 - Convocatoria de obras
VI Concurso Postales Xmas 2024,Concurso Postales Xmas 2024,VI Concurso Internacional de Postales Navideñas Full Color Xmas 2024
Prod. y exhib. MANIFESTA 15,,Residencia de producción y exhibición en el contexto de MANIFESTA 15 en Barcelona
Convocatoria paisaje,"Convocatoria paisaje, Convocatorias, Premio Internacional",Convocatoria tema el paisaje
Memorial María Luisa 2024,Premio Internacional de Fotografía,"XXXV Memorial María Luisa. Certamen Internacional de Fotografía y Video de Montaña, Naturaleza y Aventura"
Convocatoria exposiciones,"convocatoria, exposición colectiva",11ª convocatoria para exposiciones individuales o colectivas en línea
Jóvenes Artistas Canarios 2024,,Becas Jóvenes Artistas Canarios 2024
Convoc Pankhurst,Convocatoria Pankhurst 2024,Convocatòria Pankhurst 2024
Víznarte 2024-25,"Premio Internacional, Residencia para artistas, oportunidad para artistas",Víznarte 2024-25
Exposición Ilustradores Argi Arte,"Arte, convocatoria, exposición colectiva",Convocatoria internacional de Exposición para Ilustradores en Argi Arte
,VII Puchi Award,VII Puchi Award
VIII Maratón Fotográfico Cuenca,"Concurso Fotográfico, Maratón Fotográfico, fotografía",VIII Maratón Fotográfico Ciudad de Cuenca
Concurso Fotográfico “Un paraíso”,"Concurso Fotográfico, concurso de fotografía, fotografía",I edición del Concurso Fotográfico “Un paraíso ilimitado”
1er Premio Fotografía Cárnicas,"Premio de Fotografía, concurso de fotografía, fotografía",1er Premio de Fotografía Cárnicas La Guzmana. León
Grup d'Acció Creativa GAC,"Grup d'Acció Creativa GAC, Premio Internacional de Fotografía, Residencias Artísticas",Grup d'Acció Creativa GAC
Skowhegan School Painting & Sculpture,,Open Call for Applications: Skowhegan School of Painting and Sculpture
Conc. Fotografía Naturaleza 2024,"Concurso Fotografía Naturaleza, Premio Internacional de Fotografía, exposición colectiva",The Nature Photography Contest 2024
14º Conc. Pintura Rápida Lora,,14º Concurso de Pintura Rápida “Villa de Lora del Río – Manuel Urizal” 2024
Quatro. IV Muestra colectiva,exposición colectiva,Quatro. IV Muestra colectiva de creadores de Castilla-La Mancha
Santander Emplea Cultura 11,"Premio Internacional, Santander Emplea Cultura, oportunidad para artistas",Santander Emplea Cultura - 11 edición
,,YICCA 24/25 - International Contest of Contemporary Art
Máster PHotoESPAÑA 2025,"Premio Internacional, Residencia para artistas, programa de residencia",Beca Fundación Casa de México – Fundación Contemporánea: Máster PHotoESPAÑA - 2025
XIII Convoc. Arte Plástica: Retrato,"Premio Internacional, convocatoria, exposición colectiva",XIII Convocatoria de arte plástica tema El Retrato
XVIII Salón Nacional Artes Visuales,Artes Visuales,XVIII Salón Nacional de Artes Visuales Junín 2024
Concurso Fotográfico Caminos,"Concurso, Premio Internacional de Fotografía, exposición colectiva",32º Concurso Fotográfico Caminos de Hierro
,residencia de artistas,Convocatoria Abierta | Residencias Artísticas Barcelona 2024. Otoño Invierno
Convocatoria Proyectos Expositivos,"Artes Visuales, Proyectos expositivos, convocatoria","Convocatoria de Proyectos Expositivos Universidad de Murcia - Aula de Artes Plásticas y Visuales, 2025"
Studiotopia,"Residencia para artistas, oportunidad para artistas, programa de residencia",Convocatoria Internacional de Residencias Studiotopia
Getxophoto Open Call 2025,Open Call Getxophoto,Getxophoto Open Call 2025
Premio AEDAS Homes Pintura,"Pintura, Premio Internacional, exposición colectiva",I Premio AEDAS Homes de Pintura de la Ciudad de Zaragoza: Goya Today
II Prem. Nac. Pintura Omorfia,"Arte, Concurso de Pintura, Premio Nacional de Pintura",II Premio Nacional de Pintura Omorfia Ciudad de Cádiz
IV Fest Fotografía DDHH,"Arte, Premio Internacional de Fotografía, fotografía",IV Festival Internacional de Fotografía sobre Derechos Humanos y Justicia Global de Barcelona
VII Certamen Pintura Foios 2024,Certamen de Pintura,VII Certamen de Pintura Foios 2024
Loewe Craft Prize 2025,"Craft Prize, Loewe Foundation Craft Prize, Premio de Artesanía",Loewe Foundation Craft Prize 2025
Convocatoria Collective 2024,"Open Call, convocatoria, residencia de artistas","Open call artists!!! Convocatoria abierta para participar en la edición 2024 de la ""Collective Contemporary"""
"Convocatoria SACO1.2 ""Ecos. oscuros""","Bienal SACO, Ecosistemas, convocatoria","Convocatoria Internacional Bienal SACO1.2 ""Ecosistemas oscuros"""
Propuestas Vegap 2024,"Premio Internacional, Residencia para artistas, oportunidad para artistas",Propuestas Vegap 2024. XXVIII Convocatoria de Ayudas a la Creación Visual
XXII Premio Eurostars Fotografía,"Arte, Premio Internacional de Fotografía, exposición colectiva",XXII Premio Eurostars Grand Marina de Fotografía
Premio Nacional Pintura Rápida,,XXVI Premio Nacional de Pintura Rápida al Aire Libre Nicolás Megía
Entre lo que fuimos y lo que queda,"arte contemporáneo, convocatoria artística, exposición colectiva",Entre lo que fuimos y lo que queda
Identidad Urb,Identidad Urbana,Identidad Urbana
Risa en un clic,Arte Digital,La risa en un clic
Premio López-Villaseñor 2024,Premio Internacional,XXXIII Premio López-Villaseñor de Artes Plásticas 2024
Artista PRBB,,Beca Artista en residència al Parc de Recerca Biomèdica de Barcelona (PRBB)
I Concurso Colección Twin G.,,I Concurso Colección Twin Gallery
Premio AEDAS Málaga Pintura,,Mujeres. I Premio AEDAS Homes de Pintura de la ciudad de Málaga
,,Voltaire Lab open call
VersionaThyssen XXI,,#VersionaThyssen XXI
Color Awards 2024,,Color Awards 2024
Premio Eloi Gimeno Fotolibro,,Premio Eloi Gimeno al mejor Fotolibro 2024 / 3ª edición
Concurs fotografia Festa Gràcia 2024,,XXVII Concurs de fotografia de la Festa Major de Gràcia 2024
Certamen Nacional Artes Plásticas,,XXXII Certamen Nacional de Artes Plásticas Art Nalón 2024
Intercanvi Bòlit Girona,,Convocatòria d'Intercanvi amb el Bòlit de Girona
Artista en L'Académie de Fr,,Beca de Arte para la elección del artista residente en L'Académie de France de Madrid - sección artística de la Casa de Velázquez
Premi Ciutat de Palma 2024,,Premi Ciutat de Palma Antoni Gelabert d'Arts Visuals 2024
Concurso Arte Urbano Enalta,,VI Concurso de Arte Urbano Enalta
Concurso Arte en Vivo XXXII,,XXXII versión del concurso Arte en Vivo
III Premio Internacional Grabado,,III Premio Internacional de Grabado de Castilla- La Mancha
XXIV Conc. Pintura Villa Durango,,XXIV Concurso Pintura Villa de Durango
Certamen Pintura Ramón Córdoba,,Certamen de Pintura al Aire Libre Ramón Córdoba 2024
28º Premio Fotografía Humanitaria,,28º Premio Internacional de Fotografía Humanitaria Luis Valtueña
Premio mejor obra sobre papel,,Premio a la mejor obra sobre papel Colección Diezy7 - Swab 2024
Premio Fundación Carmen & Lluís,,Premio adquisición Fundación Carmen & Lluís Bassat - Swab 2024
Premio adquisición Piramidón,,Premio adquisición Piramidón - Swab 2024
,,Premio Colección de Arte Kells - Swab 2024
Premio Colecc. José L. Lorenzo,,Premio Colección José Luis Lorenzo - Swab 2024
Premio La Escalera - Swab 2023,,Premio Colección La Escalera - Swab 2023
Premi Fundació Úniques - Swab,,Premio Fundació Úniques - Swab 2024
Premio Fundació Vila Casas,,Premio Fundació Vila Casas - Swab 2024
Premio Mango Artista Emergente,,Premio Mango al mejor artista emergente - Swab 2024
Concurso Pintura Rápida Osuna,,XIX Concurso de Pintura Rápida Villa de Osuna 2024
XX Cert. Pintura Contemp.,,"XX Certamen de Pintura Contemporánea ""Casimiro Baragaña"""
Premio Nacional Fotografía 2024,,Premio Nacional de Fotografía 2024
Comp. Int. de Diseño 2024-25,,Amadeus International Design Competition 2024-2025
Festival Euforia: Cine trans/nb,,Festival Euforia: Cine trans/nb.
Convocatoria Artistas Visuales,,Convocatoria para Artistas Visuales - Agenda Exposición 2024 FRD
II Conc. Pintura Mística,,II Concurso de Pintura Mística
Muestra Arte Joven La Rioja,,Muestra de Arte Joven en La Rioja
Premi Pintura Paco Merino,,Premi de Pintura Paco Merino 2024
Snowapple Wilderness 2025,,Residencia Artística Snowapple - Wilderness 2025
XXVII Certamen Jóvenes Pintores,,XXVII Certamen Jóvenes Pintores de la Fundación Gaceta
Conflu 2025,,Confluence 2025
Concurso pintura Cerezo Moreno,Concurso de Pintura,XXXIV Concurso de pintura Cerezo Moreno
Concurso Pintura Rápida Albuixech,,III Concurso Nacional de Pintura Rápida de Albuixech
30 Concurso Latinoamericano Fotografía,,30 Concurso Latinoamericano de Fotografía Documental Los Trabajos y los Días
Concurso cartel Belén 2024,,Concurso del cartel anunciador del Belén artístico  “La Nacencia” 2024
Premis Arnau de Palomar 2024,,Premis Arnau de Palomar 2024: Arts plàstiques
XXIII Certamen Cultural Virgen,,XXIII Certamen Cultural Virgen de las Viñas
2024 Foundwork Artist Prize,,2024 Foundwork Artist Prize
Premio Eurostars Fotografía,,Premio Eurostars Hotel Company de Fotografía de Málaga
IV Convocatoria NUDO/KNOT 2024,,IV Convocatoria NUDO/KNOT para artistas e investigadores - 2024
Premio Manos Unidas Fotoperiodismo,,Premio Manos Unidas de Fotoperiodismo 2024
Arte sobre papel - FBO 2025,,Arte sobre papel - Premio FBO 2025
6 Aniv. Open Call,,#6 Anniversary Open Call
Ext. conv. 4ta. fecha año,,Extensión de convocatoria | 4ta. fecha del año
Certamen Pintura Villaviciosa,,XXVII Certamen Nacional de Pintura - Ayuntamiento de Villaviciosa 2024
Premio Arte Joven 2024,,Premio Arte Joven 2024
Visionados CAF con J.M. Navia,,Visionados CAF con José Manuel Navia
Híbrides: Small Embodied Data,,Call for Contributions. Híbrides: Small Embodied Data
Proy. expositivos 2025,,Convocatoria para la presentación y selección de proyectos expositivos del año 2025
Premio Nacional Cerámica,,17º Premio Nacional de Cerámica Ciudad de Castellón
47º Certamen Pintura Manzanares,,"47º Certamen Nacional de Pintura ""Ciudad de Manzanares"""
,,Convocatoria Exposiciones La Tetería 2025
,,Escombrarte
Museum of the Commons - Climate,,Estancias de investigación del programa Museum of the Commons – Climate de L’Internationale
Ajardinadas en PACA,,Gardening Residencies. Residencias Ajardinadas en PACA (Asturias): primavera y otoño 2024
Concurso Fotografía Turismo,,II Concurso de Fotografía “Turismo para un planeta mejor” ATF Turisferr
IV Cert. Nac. Pintura RCM,,IV Certamen Nacional de Pintura Real Club Mediterraneo
"MARE, Certamen Audiovisual",,"MARE, Certamen Audiovisual para la Conservación del Mar Balear"
Convocatoria Collective 2024,"Open Call, Residencias Artísticas, convocatoria","Open call artists!!! Convocatoria abierta para participar en la edición 2024 de la ""Collective Contemporary - Multidisciplinary"""
Premio B·Arte 2024,,Premio B·Arte 2024 Restart
B-Murals,,Residencias B-Murals
V Premio Internacional Carteles,,V Premio Internacional de Carteles MAKMA ‘Sostenible/Insostenible’
VII Certamen Fotografía PHOCO’24,,VII Certamen Internacional de Fotografía Contemporánea PHOCO’24. Valdepeñas 2024
VII Cert. Nac. Pintura Rápida,,VII Certamen Nacional de pintura rápida Santomera
XIV Certamen Creadores Lib y Paz,,XIV Certamen de Creadores por la Libertad y la Paz
Premio Fotografía UM 2024,,XXIII Premio de Fotografía Universidad de Murcia / La Cámara Roja 2024
Mujeres Mirando Mujeres,,XI convocatoria Mujeres Mirando Mujeres
Proyector Fest 2025,,Convocatoria Proyector Festival 2025
Concurso Proyectos Curatoriales,,"Concurso de Proyectos Curatoriales 2024, FNA"
Concurso Figurativas 2025,,Concurso Figurativas 2025
Artistas en Francia 2025-26,,"Artistas en Residencia, Academia de Francia en Madrid"
Gasworks para artistas arg.,,Residencia Gasworks para artistas argentinos
,,"Beca de Historia del Arte y Cultura Visual, The Met"
Financ. Cult. CulturEU,,Guía CulturEU de financiación para las industrias culturales
Concurso Figurativas 2025,,Abierta la convocatoria al concurso Figurativas 2025 de pintura y escultura
Premio Primavera Novela 2025,,Premio Primavera de Novela 2025 convocado por Espasa y Ámbito Cultural
Festy Intl Cine Yungas,,Festival Internacional de Cine de las Yungas (FICY) – Competencia latinoamericana de cortos
Gasworks (Londres) artistas arg.,,Residencia Gasworks (Londres) para artistas argentinos
Concurso Proyectos Curatoriales,,Concurso de Proyectos Curatoriales 2024 del Fondo Nacional de las Artes
Circulación Obras Lit. Europeas,,Convocatoria para Circulación de Obras Literarias Europeas 2025
Premios MUSE Photography 2025,,Los premios MUSE Photography Awards tienen abierta su convocatoria 2025
Exposición y Artistas,,Exposición y Residencia de Artistas
,,EU Funding & Tenders Portal
FotoCreativaBA 2024-25,"oportunidad para artistas, programa de residencia, residencia artística",FotoCreativaBA Residencia Artística 2024-2025 [Member of Res Artis]
FotoComBA Fotografía Expandida,"Premio Internacional de Fotografía, Programa Internacional de Fotografía Expandida",FotoComBA Programa Internacional de Fotografía Expandida 2025
Open Call Proyector,Open Call,Open Call Proyector 2025
Premio Fundación MACBA,,Premio Fundación MACBA
7mil y pico balas,,4ª Convocatoria de Obra Colectiva «Siete mil y pico balas»
Mujeres Mirando Mujeres XI,,Convocatoria para la XI edición de Mujeres Mirando Mujeres
Premio Tomás Francisco Prieto,,XXXI Premio Tomás Francisco Prieto 2024
Mejor Stand Estampa,,Mejor Stand Estampa 2023
Premio Cervezas Alhambra,,Premio Cervezas Alhambra - Estampa 2024
Premio Campocerrado 2024,,Premio Colección Campocerrado - Estampa 2024
Premio Colecc. Kells - Estampa,,Premio Colección Kells - Estampa 2024
Premio Colecc. La Escalera,,Premio Colección La Escalera - Estampa 2024
Premio Navacerrada - Estampa,,Premio Colección Navacerrada - Estampa 2024
Premio Comunidad de Madrid,,Premio Comunidad de Madrid - Estampa 2024
Premio Klasse - Estampa,"Estampa 2024, Premio Internacional, Premio Klasse, Premio de arte digital",Premio Klasse - Estampa 2024
Premio La Escalera - Swab,Premio Internacional,Premio Colección La Escalera - Swab 2024
Premio mejor stand Swab,"Premio Internacional, convocatoria, exposición colectiva",Premio al mejor stand Swab 2024
Premio Benoît Doche,Arte Sonoro,Premio Benoît Doche de Laquintane Collection - Swab 2024
Pleamar Sound Art,"Open Call, Premio Internacional, convocatoria",Open Call – Pleamar Sound Art
Proyector Fest 2025,"Proyector Festival, convocatoria para artistas, recursos culturales",Proyector Festival 2025 abre convocatoria para artistas
Concurso Etiquetas Vino,"Concurso Nacional de Diseño de Etiquetas, Concurso de Diseño, Diseño de Etiquetas de Vino",Concurso Nacional de Diseño de Etiquetas de Vino
"Comp. Intl. Arte ""Natur 2024""","Premio Internacional, arte contemporáneo, convocatoria",Call for International Art Competition. ”Nature 2024”
Concurso Porcelana Shang Yun,"Concurso de Branding, recursos culturales",De Shang Yun Porcelain Branding Contest
Studiotopia,Open Call Studiotopia,Open Call – Studiotopia
Next-Gen Opera,Opera contemporánea,Next-Gen Opera (Mortier Award)
Feria del Fotolibro 5ª Ed.,Feria del Fotolibro,Participación en la Feria del Fotolibro 5ª Edición
Exposición White Balance,"arte contemporáneo, exposición, participación artística",Participación exposición White Balance
Mostra FemArt 2024-25,Exhibición,"Mostra FemArt 2024-2025 ""No me cuida la historia, me cuidan las archivas"""
Fine Art Awards 2024,"Arte, Premio Internacional de Fotografía, exposición colectiva",Fine Art Awards 2024
On paper,Grabado,On paper
Technarte Bilbao 2025,Premio Arte y Ciencia,Technarte Bilbao 2025
Exposición Otoño 2024,,XXIX Exposición de Otoño a Nivel Autonómico 2024 ''Peña Los Tranquilotes''
Premi Pintura Algemesí,,XXX Premi de Pintura Ciutat d'Algemesí
,,XII Certamen de Pintura Contra la Violencia de Género - No al Silencio 2024
Ecologías de la pausa 2025,,Ecologías de la pausa 2025
"Exposición digital colectiva ""Santos""",,"Convocatoria para exposición digital colectiva ""Santos"""
Convocatòria imatge gràfica Stripart 2025,,Convocatòria per la imatge gràfica del festival Stripart 2025
Post-doc Dinamarca,"Becas de posgrado, OEA, Programa de becas",Becas de Post-grado en Dinamarca
,"AIAS-AUFF, Becas Senior, Dinamarca",Becas Senior en Dinamarca
Conservación e Investigación en el Met,"Becas de investigación, Investigación",Becas en conservación y en investigación científica en el Metropolitan Museum of Art en Estados Unidos
Gomma Grant Fotografía,"Premio Internacional de Fotografía, convocatoria, recursos culturales",Beca Gomma Grant de fotografía abre convocatoria 2024
,"Cine Independiente, Convocatoria BAFICI, Festival Internacional de Cine",Convocatoria al Festival Internacional de Cine Independiente (BAFICI)
Creación en arte y artesanías,"Residencia para artistas, oportunidad para artistas",Beca de creación en arte y artesanías
Premio Joves Creadores,,Abierta la convocatoria de cortometrajes Premio Joves Creadores
